title,is_informative
Les pires jobs de l&#39;Histoire - 3ème fournée,1
Des tunnels sous Arras ? #shorts,1
Pourquoi aucune femme n&#39;a régné sur la France ?,1
Les survivants de Pompéi #Shorts,1
Des frontières invisibles : la posture permanente de sécurité #Shorts,1
Des gravures rupestres et de la prise de drogue #Shorts,1
Les Invalides cachent quelques secrets… je vous montre !,1
Les 10 ans de Nota Bene ! 14h-00h,1
La découverte d&#39;un ancien bras du Nil #Shorts,1
Le casse tête des 312 000 ponts français,1
Fortune de France #Shorts,1
Michel Barnier et l’histoire de la condamnation de l’homosexualité,1
L&#39;étrange naissance de la 1ère centrale nucléaire française,1
Inoxtag et l&#39;Everest : un rêve de riche ?,1
Quel sera le sujet de mon prochain livre ? #shorts,1
Des fresques de la guerre de Troie à Pompéi #Shorts,1
"Desmond Doss, le soldat volontaire qui refusait de tenir une arme",1
L&#39;histoire des Pirates avec la chaîne @natgeofr ! #Shorts,1
La première épave pirate retrouvée ! - Le naufrage du Speaker,1
L&#39;arrivée de Homo Sapiens en Asie ! #Shorts,1
La drôle de vie des langues mortes,1
La Pompéi Britannique #Shorts,1
La première réclamation client de l&#39;histoire #Shorts,1
Lovecraft et le mythe de Cthulhu,1
10 ans de Nota Bene !,1
La seule détentrice de la Medal of Honor #Shorts,1
"L&#39;Indochine : la Guerre d’Indochine, et ses mémoires (1946 à nos jours) - Partie 3",1
Le goût de la bière dans l&#39;histoire #Shorts,1
Quelle est la véritable place de l&#39;Église au Moyen Âge ?,1
L&#39;histoire de Qiu Jin #Shorts,1
Que raconte le journal intime d&#39;Hitler ? - Les faussaires de l&#39;Histoire,1
3 bandits qui ne rigolent pas,1
L&#39;Indochine : de l’occupation japonaise à la reconquête française (1940-1946) - Partie 2,1
Cette machine antique est utilisée PARTOUT autour de nous !,1
L&#39;histoire du comte de Montecristo et le film ! #Shorts,1
"Tout le monde s&#39;engueule sur la laïcité, mais c&#39;est quoi ? Feat &quot;Vous Avez Le Droit&quot;",1
(encore) un homme qui s&#39;est autoproclamé roi #Shorts,1
L&#39;Histoire de la bière,1
La daronne d&#39;Amine est actrice ?,0
Ce pote,0
72h enfermés dans les catacombes,0
Jonathan Cohen et Squeezie en chaussettes (ft Freddy Gladieux &amp; Jeantou) - Micro Chaussettes #1,0
Ne faites pas vos créneaux comme Évelyne,0
"Qui sera la meilleure génération ? (ft Djilsi, Maxime Biaggi &amp; Billy)",0
Squeezie fait un accent raciste ?!,0
Je fais un cadeau au professeur,0
"La dernière avant un moment, merci ❤️",0
Théodort tombe amoureux d&#39;une comédienne,0
Maxime a leak toutes mes infos,0
Bigflo se trouve moche ?,0
J&#39;ai mis la mère de Billy dans un canon,0
Qui est le vrai marionnettiste ?,0
Qui est la vraie Cowgirl ?,0
N&#39;acceptez pas son invitation... (Thread Horreur Halloween),0
McFly &amp; Carlito nous pètent dessus,0
QUI EST L&#39;IMPOSTEUR ? (ft Charles Leclerc &amp; Pierre Gasly),0
QUI EST L&#39;IMPOSTEUR ? (ft Jérôme Niel &amp; Panayotis Pascot),0
Les pires idées des scientifiques...,0
"Le meilleur duo évite la prison #2 (ft mon frère, Bigflo &amp; Oli)",0
Ce prêtre mène une double vie incroyable,0
QUI EST L&#39;IMPOSTEUR ? (ft Pierre Niney &amp; François Civil),0
Ces marques sont allées trop loin...,0
"T&#39;es pas drôle, tu sors (ft Joyca, Maxenss)",0
QUI EST L&#39;IMPOSTEUR ? (ft SCH &amp; Soso Maness),0
Il a fait exploser le casino qui l&#39;a ruiné,0
QUI EST L&#39;IMPOSTEUR ? (ft Eric &amp; Ramzy),0
Elles sont tombées dans un piège sinistre... (4 vraies histoires d&#39;horreur),0
QUI EST L&#39;IMPOSTEUR ?  (ft Vald &amp; Naza),0
Ils ont passé la pire soirée de leur vie,0
Le plus grand imposteur de l&#39;histoire,0
Il s&#39;est retrouvé face à un tueur... (4 vraies histoires d&#39;horreur),0
&#39;WHO&#39; mon 1er court-métrage d&#39;horreur,0
QUI EST L&#39;IMPOSTEUR ? #4 (ft Orelsan &amp; Clément Cotentin),0
"QUI EST L&#39;IMPOSTEUR ? #3 (ft Jamel Debbouze, Alice Belaïdi)",0
"Ils ont vécu une VRAIE histoire d&#39;horreur (ft Sofyan, Kim, Clotaire)",0
Il s&#39;est enfermé là-dedans et c&#39;était une mauvaise idée,0
"QUI EST L&#39;IMPOSTEUR ? #2 (ft Djimo, Roman Frayssinet)",0
J&#39;ai pu acheter ça sur internet,0
"Si vous l’apercevez, vous êtes sauvé",0
"QUI AURA L&#39;OBJET PIÉGÉ ? (ft Billy, Maskey, Hugo)",0
n’empruntez jamais ce tunnel…,0
le plus &quot;gentil&quot; criminel du monde,0
CACHE-CACHE VERSION LÉGENDAIRE,0
Vous allez rire et vous regretterez,0
Ils se sont retrouvés dans un énorme bourbier,0
ne touchez pas à ses affaires...,0
Squeezie - Canard (Clip Officiel),0
"QUI EST L&#39;IMPOSTEUR ? (ft Mister V, Jonathan Cohen)",0
Cette caméra à plus de 20 ans,0
Vous pensez quoi de ma doublure ? #sosie,0
Comment tourner chez Netflix ? #astuce,0
Je reconstruis mon décor d’il y a 10 ans,0
"LES DOCUMENTAIRES (ft. Mastu, Amixem, Natoo)",0
Je veux aller au chili maintenant…,0
L’Apple Vision PROOOO,0
Mon double IA a des bugs je crois,0
Je rencontre mon intelligence artificielle,0
NE CROYEZ PAS CETTE VIDÉO,0
Comment je suis arrivé là #explorenicecotedazur,0
Ma réaction en découvrant mon char #explorenicecotedazur,0
La pub dans les jeux mobiles,0
"J’ai créé un tournoi d’esport, admirez les sponsors",0
Je transforme @theodortytb 🪄,0
Mon cauchemar sur les tournages…,0
Comment on se transforme en diable 😈,0
Vous préférez quel costume ? (le mien pèse une tonne),0
Je ne suis pas cascadeur…,0
"Et toi, c’est quoi le jeu mobile que t’as le plus poncé ?",0
LES JEUX MOBILES OUBLIÉS,0
Le char va être COLOSSAL #explorenicecotedazur,0
Ce que j’ai vu au Japon (partie 2),0
Ce que j’ai vu au Japon (partie 1),0
Je vous dévoile enfin mon dessin,0
Le sosie de DJ Snake,0
J’ai qu’une seule prise… 🧱,0
"Ça me va bien, chauve 👨🏻‍🦲 ?",0
LES PUBS vs LA VIE (l&#39;épisode avec l&#39;ourson),0
"Donnez-moi vos idées, ça va être fou ✍️",0
Des lycéens jugent mes photos d’ado,0
Je deviens COACH EN TECKTONIK,0
"Et vous, vous demanderiez quoi ?",0
Je fais passer un quiz « année 2000 » à des ados…,0
CYPRIEN - L&#39;ADOLESCENCE,0
Les délégués de classe,0
Pourquoi j’ai toujours les pires costumes ?,0
Ce qu’on a coupé au montage…,0
J’ai transformé Stéphane Bern en personnage de jeu vidéo,0
LE MASHUP DES JEUX VIDÉO,0
Cyprien - ma vie de papa,0
J’ouvre mon cadeau d’anniversaire,0
L’adaptation live de One Piece,0
Le CLASH des animés,0
Sympa l’ambiance chez Twitter (avec @SympaCool),0
La plainte du @joueurdugrenier,0
"Le SAV d&#39;internet (TikTok, X...)",0
Vous n&#39;avez pas vu ça (making of Fujisan),0
Fujisan (court métrage),0
CYPRIEN - LE JAPON 3,0
Des choses à vous dire...,0
LA COUPE DU MONDE (Pour ou Contre?)(Norman),0
LA W**D DANS LE CORPS (Norman),0
LEQUEL EST VEGAN ? (Cuisine trompe-l&#39;oeil 2),0
NORMAN - LES MARIAGES 💍,0
Le vrai goût des bonnes choses 🤌,0
J’ai plus de salive…,0
VLOG en Côte d&#39;Ivoire (et mon père se marie),0
Mon projet pour braver la canicule☀️🌡🔥Vous avez d’autres astuces ?,0
LES PETITES MANIES,0
ÉLECTION PRÉSIDENTIELLE 2022 (y&#39;a rien qui va),0
LES PIRES TIKTOK (PARODIE),0
AVOIR LE COVID 🦠 (en 2022),0
MES DESSINS (suite) ✏️♥️ #SHORTS #cadeaudenoel,0
Le meilleur cadeau de Noël 🎁🎄(en toute objectivité 😅) #SHORTS,0
Une heureuse nouvelle !,0
L&#39; ALCOOL DANS LE CORPS,0
LE PIRE PIÈGE D’HALLOWEEN 😱🎃,0
SQUID GAME,0
NOTRE NOUVEL APPART (passion travaux) (Norman &amp; Martha),0
LES MESSAGES VOCAUX,0
JE PASSE LE PERMIS À 34 ANS (avec résultats),0
NORMAN - VALHALLA (CLIP),0
LE MAROC 🇲🇦 (VLOG COUP DE COEUR),0
LE CODE DE LA ROUTE (suite et fin),0
SI 2020 ÉTAIT UN HUMAIN...,0
NORMAN - LES LIVRES (produits non essentiels),0
NORMAN - LA CUISINE TROMPE L&#39;OEIL (avec Morgan VS),0
NORMAN - ÊTRE PARENTS,0
"NORMAN - LES SÉRIES (Netflix, Prime Video...)",0
NORMAN - LE DÉCONFINEMENT,0
NORMAN - LE CONFINEMENT 2,0
RESTEZ CHEZ VOUS,0
NORMAN - LE CONFINEMENT,0
NORMAN - UN VLOG PAS COMME LES AUTRES 😷,0
FAIRE UN RÉGIME (ft Tibo InShape),0
NORMAN - LES ANNÉES 2000,0
LE TALISMAN - ÉPISODE 3 (NORMAN &amp; LUDOVIK),0
LE TALISMAN - ÉPISODE 2 (NORMAN &amp; LUDOVIK),0
LE TALISMAN - ÉPISODE 1 (NORMAN &amp; LUDOVIK),0
CETTE VIDÉO EST SUPPRIMABLE,0
HARRY POTTER !,0
MON NOUVEAU SPECTACLE !,0
NORMAN - L&#39;ÉCOLE DES VAMPIRES (court-métrage),0
NORMAN - KEBAB À 6€ VS KEBAB À 1000€,0
BABY ROUTINE - NORMAN,0
NORMAN - LE STYLE,0
MON CHAT CONDUIT UNE VOITURE !,0
NORMAN - CHAT EN MISSION,0
NORMAN - AVOIR UN BÉBÉ,0
Les post-it de l&#39;extrême !!! 😲😲,0
Cet objet a une histoire : la pièce romaine 🪙,0
On survit 24H dans un arbre ! (le résultat est fou),0
Quiz de sosies ! 😎 #amixem #sosies #shorts,0
Ça gonfle ! 😮‍💨😮‍💨 #amixem #experiment #shorts,0
ON TESTE LES PROMESSES DES PUBLICITÉS #2 (ils abusent de fou),0
ÉTOILÉ ou SURGELÉ ? (le jeu de dégustation IMPOSSIBLE) #5,0
On vous présente François Éducation Civique ! 🤣🤣 #amixem #shorts #comedy,0
J&#39;ai enfilé une combi BDSM et voilà ce qui s&#39;est passé ! 👀 #amixem #humour #shorts,0
ON TESTE DES CAMPINGS notés 1 ÉTOILE !,0
Guess These Movie Character Look-Alikes! 🎬👀 #amixem #humour #shorts,0
900€ pour ça ??! 😫😫 #amixem #humour #shorts,0
LES PIRES OBJETS EBAY #5 (que des dingueries...),0
J&#39;AI ACHETÉ UN SOUS-MARIN sur AliExpress 🤯 (t’as bien lu),0
Le bras clignoteur 😂 😂  #amixem #shorts #cars,0
On teste la poterie 🤣🤣 #amixem #humour #shorts,0
J’ai acheté tous les objets des pubs TikTok #3 (ça devient dangereux),0
Un &quot;léger&quot; décalage 😱😱 #amixem #humour #car #shorts,0
La pire frayeur de Thomas 😱😱 #amixem #humour #shorts,0
De quelle star est-elle la sosie ? #amixem #shorts #humour,0
Pause technique ! #amixem #shorts #car,0
That&#39;s a golf cart 🤣 #amixem #golf #shorts,0
Ces gens sont TROP qualifiés pour leur JOB 😱,0
Quiz Cosplay ! #amixem #challenge #cosplay,0
24H ENFERMÉS DANS UNE CABANE (pour faire un son) ft. Petit Biscuit,0
Le bras robot flippant ! #amixem #shorts #technology,0
Amixem feat. @PetitBiscuit : RDV dimanche  #amixem # petitbiscuit #musique,0
Who&#39;s who ? #amixem #shorts #humour,0
Une grenade pour éteindre un feu 🔥 #amixem #experiment #shorts,0
J&#39;AI ACHETÉ LA PORSCHE LA MOINS CHÈRE POSSIBLE (c&#39;est une épave 😭),0
Tatiana le robot 🤖 #amixem #technology #shorts,0
Attention Léon Marchand on arrive 🥇 #amixem #sports #shorts,0
Tasting MrBeast&#39;s Chocolate 🍫 #amixem #food #shorts #mrbeast,0
Les secrets de la FUSÉE ARIANE 6 🚀 #amixem #shorts #space,0
300 JOURS AVANT QUE CETTE FUSÉE DÉCOLLE (ou explose en plein vol 😭),0
&quot;I have a suitcase&quot; in other languages 🌍 🤣 #amixem #shorts #mrbeast,0
ON TESTE 100 SPORTS ! (et on les juge)(on est au bout du rouleau),0
This dog robot is insane ! #amixem #shorts,0
Le plus gros secret du Youtube game 🤫 #amixem #humour #shorts,0
Extrait : Breaking Bad 😱 #amixem #humour #shorts,0
J’ai survécu 40H à une vidéo de MrBeast ! (enfermé dans un cube),0
ON JUGE 50 SOSIES #2 (c&#39;est choquant !) ft. Alban Ivanov,0
"Boukistan, le clip 🎵 #amixem #song #shorts",0
J’ai Acheté L’Île Privée La Moins Chère Du Monde,0
Scène coupée : Seuls en Amazonie #amixem #shorts #adventure,0
Extrait : Sosie de Timothée Chalamet ? #amixem #humour #shorts #timotheechalamet,0
CARLITUS !!! #amixem #humour #shorts #lego,0
On construit le pire LEGO avec Mcfly et Carlito,0
ON TESTE LES PROMESSES DES PUBLICITÉS (c’est incroyable 😮),0
ON VIT 24H COMME DES PRÉSIDENTS,0
Bigger chest workout at home !! 🔥,0
One day or day one ! 🙏,0
Netflix poster !! 😂😂,0
99 problems ! 😔😔,0
yelling !! 😱😱,0
4 exercises to build bigger biceps !! 😱,0
Stay sober ! 🙏,0
Strong woman !! 😱😱,0
LA MUSCU A RUINÉ SON COUPLE !!,0
Use your brain !! 🧠😱,0
Creatine evolution !! 😂😂,0
Push up challenge !! 🙏,0
Fight sadness !! 🙏,0
Smoking at the gym !! 😱😱,0
I can do it too !! 😂😂,0
Fitness school ! 🙏,0
A real hero !! 👏👏,0
Healthy lung test !! 🫁😱,0
Incline bench difference !! 😱,0
Cristiano Ronaldo abs workout routine !! 😱😱,0
100 push ups ! 😂😂,0
Discipline !! 🙏,0
Best hangover cure !! 😱,0
Healthy lung challenge !! 🫁,0
Hold plate challenge !! 😂😂,0
What’s the point of this exercise ? 😂,0
How to get bigger chest at home workout !! 😱,0
I want it !! 😱😱,0
Muscle up challenge !! 😂😂,0
I want bigger biceps.. 😔😔,0
Stop this girl !! 😱😱,0
Military lung test !! 🫁🪖,0
Dragon ball Z trend !! 😂😂,0
Cable lateral raises be like ! 😂😂,0
Healthy lungs test !! 🫁💪,0
Stop doing fancy exercises !! 😱😱,0
She should be banned from the gyms !! 😱😱,0
How to make whey protein ?? 😱😱,0
New sport !! 😂😂,0
When you drop water on your phone !! 😱😱,0
Healthy lungs test !! 🫁💪,0
The gym ! 🙏,0
Dangerous !! 😱😱,0
Baseball bat !! 😱😱,0
We all start one day 🙏,0
I’m the new Anatoly !! 😂😂,0
Go to the doctor now !! 😱😱,0
Broken iPhone !! 😱😱,0
The best Therapist !! 😂😂,0
Abs on her back !! 😱😱,0
le grand bêtisier des vlogs d’août,0
le dernier vlog d’août…,0
mes potes ont créé un festival !!!!,0
on a fait ce qu’il fallait faire à Amsterdam,0
on a dormi dans une GRUE (pour de vrai),0
j&#39;ai traversé la France juste pour ça...,0
un nouveau membre dans la team  🥹,0
C&#39;EST QUI MAXIME ? - Clip officiel,0
les retrouvailles,0
j’ai fait pleurer mon meilleur ami *surprise*,0
comment bien s’ennuyer en vacances,0
on a fait tout ça pour des INCONNUS,0
c’est le premier jour de..,0
notre vie de ranch à Paris,0
on aurait pas du faire ça un soir de pleine lune...,0
il est enfin de retour 🥹,0
on s&#39;est embrouillés pour la première fois...,0
le retour de la vie parisienne,0
un jour férié quoi,0
jet lag,0
ils testent le simulateur de douleurs de règles *intense*,0
baignade avec des requins,0
des amis à Miamiiiiii,0
le dernier stop du voyage,0
notre vie de cowboy dans un ranch au Texas,0
un membre de la team nous quitte,0
on a fini au tribunal aux USA ( c’est pas une blague ),0
las vegas,0
en panne dans le désert de Las Vegas....,0
premier stop: LOS ANGELES,0
nous sommes arrivés à...,0
une journée olympique,0
l&#39;année du changement,0
LES VLOGS D’AOÛT VOYAGENT,0
LA FIN DES VLOGS D’AOÛT ?,0
IL Y A UN MYTHO DANS MES POTES,0
JE REFAIS TOUT MON APPART !,0
met gala,0
LE AIRBNB LE PLUS DEMANDÉ AU MONDE,0
J&#39;ÉTAIS AU GP EXPLORER :),0
j&#39;ai du supprimer ces scènes,0
on a passé la nuit dans un parc aquatique,0
on ne va plus jamais conduire de bateau,0
on a dormi dans ça...,0
on s&#39;envoie en l&#39;air !,0
j&#39;ai failli empoisonner tous mes potes ( oups ),0
on a du appeler les urgences pour Oli avant le concert,0
on recharge les batteries,0
je deviens l&#39;assistante / régisseuse d&#39;Angèle 💖,0
une inconnue a SAUVÉ notre journée !,0
"SURVIVRE JUSQU’À L’AUBE (Ft. Baghera, LeBouseuh et Valouzz)",0
"ÉNORME CACHE-CACHE dans une VILLE du DÉSERT ! (Ft. Elsa, Raska, Doigby et Nicotine)",0
"8 YOUTUBEURS DANS UNE COURSE DE FIAT PANDA ! (avec GMK, Lebouseuh, RagnarLeBreton, LaBoiserie …)",0
"J’AI FAIT GOÛTER MON CANDY&#39;UP À L&#39;ÉQUIPE, Y&#39;A DÉBAT ! #candyup #candyupchocococo #candyupmichou",0
J’ai NAGÉ dans une rivière INFESTÉE de PIRANHAS ! (24h en Amazonie),0
"ILS ONT EXPLOSÉ MON STUDIO, J&#39;AI FLIPPÉ 😂😭  #michou #humour #divertissement #10million",0
"QUI SERA LE MEILLEUR SURVIVANT ? (Ft. Raska, Billy, Elsa, Nico et Flamby)",0
JE SUIS RESTÉ BLOQUÉ DANS UN ASCENSEUR 😭💀 #michou #elevator #vlog #funny,0
SURVIVRE 3 Jours SEUL en MER !,0
ÇA A MAL TOURNÉ 😂😭💀 #michou #humour #divertissement #prank #troll,0
C’EST LA SEULE QUI SAIT ME CANALISER… ❤️‍🩹 #michou #dog #animals #trend #love,0
JE VOUS FAIS MON TOP 10 DES PLATS 🤤😋🍽️ #michou #divertissement #top #top10,0
"CACHE-CACHE GÉANT au FAR WEST ! (Ft. Elsa, Doigby, Raska, Nicotine)",0
NOS MEILLEURES ANECDOTES AVEC ELSA 😍🤫 #michou #divertissement #michou #interview,0
🕺🍆😂 #michou #humour #divertissement #challenge #dance,0
"200 BOUTONS MYSTÈRES mais 1 SEUL nous fera SORTIR ! (Ft. Elsa, Alizée et Charles)",0
JE CLASSE LES DIFFÉRENTS SPORTS POUR FAIRE MON TOP 10 🔥💪 #michou #divertissement #sports #top10,0
1 MOIS pour TRANSFORMATION PHYSIQUE ! (et gagner un combat de boxe),0
JE DÉCOUVRE LE TOP 50 MUSIQUE AU MAROC 🇲🇦 #michou #divertissement #maroc #top #song,0
"JE DÉBALLE DES COLIS PERDUS, J’AI DÉCOUVERT UNE DINGUERIE 😱 #divertissement #michou #unboxing",0
Yuki fait un test de personnalité #michou #divertissement #dog #humour #drole,0
"BATTLE ROYALE IRL ! (Ft. Elsa, Doigby, Nicotine …)",0
ON PART EN VOYAGE 🧳 #michou #divertissement #voyage #trip #usa,0
J’OUVRE MON RESTAURANT ! (Mealy),0
Je prank la copine de Timoute #humour #prank #michou #divertissement,0
VACANCES en SICILE avec ELSA 🌊,0
"SURVIVRE dans la ZONE 51 ! (Ft. Joyca, Lebouseuh, Grim, Byilhan)",0
J’AI ACHETÉ UN BOX REMPLI DE COLIS PERDUS ! (on peut trouver des dingueries),0
J’AI VOULU FAIRE UN CADEAU À ELSA … 😂,0
ESSAYER DE NE PAS CRIER PENDANT 24H (Feat. Mastu),0
J’AI PRÉPARÉ LE REPAS DU RAMADAN À LA MAISON ! (un ftour presque parfait),0
48H POUR CONSTRUIRE UN IGLOO À -30°C ! (froid extrême 🥶),0
J’AI VLOGGÉ DANSE AVEC LES STARS D’INTERNET ! (je redanse après 2 ans),0
LEBOUSEUH ME MONTRE SA DANSE (j’ai mon plus gros fou rire 🤣🤣),0
CACHE-CACHE Dans Une ÉNORME VILLA En BELGIQUE ! (Feat. Les Croûtons),0
J’AI GOÛTÉ LES PRODUITS ALGÉRIENS POUR LA PREMIÈRE FOIS ! 🇩🇿🤤,0
LA POLICE M’A ARRÊTÉ ET RETIRER MON PERMIS ! … 👮‍♂️🚨,0
ILS DÉCOUVRENT LES EXPRESSIONS DES JEUNES 😂😂,0
"CHOC DES GÉNÉRATIONS (Ft. Jean Reno, Chantal Ladesou et Kev Adams)",0
"QUI EST LE TUEUR ? #2 (Ft. Maskey, Feldup, PapeSan, Sofyan)",0
J’AI UNE CHIENNE DONC BIEN SÛR QUE … (yuki a encore fait une dinguerie 😭),0
UN COUPLE S’EST CRÉÉ PENDANT MON TOURNAGE !! 🥵💅,0
"TU PERDS, TU PRENDS UN GAGE (Ft. Cédric Doumbé, Inoxtag, Hakim Jemili, Redouane, Sam’s)",0
J’AI NOTÉ LA NOUVELLE MARQUE DE BOISSON DE FASTGOODCUISINE ! 🥤,0
J’AI GOÛTÉ LES CHOCOLATS DE MRBEAST ! (Feastables 🍫😍),0
YUKI DÉCOUVRE LA NEIGE POUR LA PREMIÈRE FOIS 🥰🐕,0
"SCHOOL RP IRL 2 (feat. Inoxtag, LeBouseuh, Alizée)",0
"ASKIP T’AS DU TALENT ? (Ft. Kalash, Jérémy Nadeau)",0
J’AI REÇU UN COLIS SURPRISE DE LA PART DE NINTENDO ! 😍❤️,0
"L’ASCENSEUR 2 : Qui sera le dernier Survivant ? (Ft. Elsa, Doigby, Alizée, Mattkev)",0
ON ENTRAÎNE NOS PICKS ! (League of Legends avec Tweekz),0
On va bouffer du tuto… à l&#39;aide ! (Planet Coaster 2) #2,0
LES GAMES SONT DURES ! (League of Legends avec Tweekz),0
ANNONCE LÉGENDAIRE ! (Il n&#39;y a pas d&#39;autre mot pour qualifier le banger qui vous attend),0
VOTRE DUO PRÉFÉRÉ EST LÀ ! (League of Legends),0
J&#39;AVAIS OUBLIÉ À QUEL POINT C&#39;ÉTAIT COMPLEXE 🙃 (Planet Coaster 2) #1,0
POUR ÊTRE AUSSI FORT QUE FAKER ! (League of Legends),0
BESOIN D&#39;UNE CHAMBRE ? (Motel Manager Simulator),0
On ne s&#39;entraîne pas pour rien avec Tweekz... (League of Legends),0
Quelqu&#39;un pour me détrôner ? (GeoGuessr),0
ON FARM LES LP ! (Session XXL sur League of Legends),0
La VÉRITABLE FINALE de Roland-Garros ! (🔴 Rediffusion complète live tennis),0
Kick attaque : Twitch est en panique…,0
LES TROIS LÉGENDAIRES ! (For The King ft. LowAn &amp; Jiji),0
On continue Diablo IV en chill... et on discute !,0
Je participe à la première du Xariathlon !,0
D&#39;où viennent nos noms de famille ? (REACT),0
QUI POURRA NOUS ARRÊTER ? (Crusader Kings III) #5,0
COMMENT JE ME SUIS CASSÉ LA CLAVICULE ! (Storytime),0
À LA CONQUÊTE DU MONDE… (Crusader Kings III) #4,0
INCLINEZ-VOUS DEVANT MOI ! (Crusader Kings III) #3,0
"LE CERCLE ! (ft. Gotaga, Ahmed Sylla, Camille Combal, Jbzz, Doigby &amp; Xari)",0
Il faut qu&#39;on parle du tchat sur Popcorn...,0
LE DOUX PIERRE ALEXIOS ! (Crusader Kings III) #2,0
BIENVENUE DANS L&#39;EMPIRE BIZOTIN ! (Crusader Kings III) #1,0
Le retour des vidéos qui font du bien ! (REACT animaux),0
"Matez-moi ce swing !⛳ (Golf Gang avec Jiji, Xari et Lowan)",0
Pourquoi je ne fais pas le GP Explorer 2 ?,0
MON EMPIRE S&#39;ÉTEND ! (Turmoil) #2,0
LE ROI DU PÉTROLE ! (Découverte de Turmoil) #1,0
JE SUIS AVEC DES MONSTRES ! (Tournoi PokerStars Main Event SCOOP),0
"LE SHÉRIF EST DE SORTIE ! (West Hunt avec Xari, Jiji &amp; LowAn)",0
"&quot;C&#39;est trop grand, ça m&#39;angoisse&quot; 😭  (React Maisons &amp; Villas de luxe)",0
Découverte de la map Qualifiglaçon ! (TrackMania - ZLAN 2023),0
On regarde des vidéos de clubs de foot amateur ! (ils sont déter),0
Découverte de Roboquest (et retrouvailles) avec MrBboy45 !,0
Bon… ZLAN ou pas ZLAN ?!,0
"Comment peut-il encore être en liberté ? (Harcèlement, menace de viol…)",0
On construit la meilleure défense ! (Tower Tactics: Liberation),0
T&#39;as vraiment cru que c&#39;était moi ?! (Découverte de Deceive Inc.),0
C&#39;EST LA RÉVOLUTIOOON ! (Contraband Police) #5,0
Un meilleur douanier que Michou ??? (Contraband Police) #4,0
La guerre des douaniers est déclarée ! (Contraband Police) #3,0
"Est-ce qu&#39;on est des enfoirés ? (Trolley Problem, Inc.)",0
Oh la bavure… (Contraband Police) #2,0
“Hop hop hop qu&#39;est-ce qu&#39;on a là…” (Contraband Police) #1,0
Pas sur que je voulais voir ces choses-là… (REACT TikTok et vidéos de bouffe),0
"LE RETOUR DES GOULES 😨 ! (Sons of the Forest avec Jiji, Xari &amp; LowAn)",0
Dicey Dungeons : la re-DÉ-couverte ! (vous l&#39;avez ?),0
C&#39;est toujours aussi bon… (Slay the Spire),0
Une semaine avec les Sherpas en France !,0
24h avec moi pour la sortie de mon documentaire KAIZEN !,0
On a reconstruit les Backroom dans la vraie vie ! (Making-of 48H) !,0
24H pour faire un triathlon avec le Champion du monde Paralympique ! (L&#39;entrainement est trop dur !),0
NE METTEZ SURTOUT PAS CE CHAPEAU !  (ft. Michou et Bily),0
Il a fait un Film sur ma vie ! (Je réagis et je donne mon avis critique...),0
Top 10 d’animés à voir absolument ! (Je fais ma tier list spécial anime),0
24 h dans ma journée d’entraînement à Paris ! (Ft. Mangaworkout),0
Je fini nu en plein stream.. (si tu perd t’enlève un vêtement),0
On a dormi au sommet d’une montagne ! (2 mois avant l’Everest),0
24 h menotté avec Amine ! (C’était insoutenable mdrrr…),0
Voilà pourquoi il ne faut faire confiance à personne… (Survivor RP) !,0
J’ai trouvé un trésor sur une île déserte ! (Survivor RP),0
Pourquoi 2023 est La meilleure année de ma vie ?! (pour l’instant en tout cas),0
"20 survivants sur une Île, il en restera qu’un… (Survivor RP) ! #1",0
On appelle des gens au hasard dans notre répertoire avec Mcfly et Carlito,0
Je prends feu en plein live ! (Je m’y attendais pas…),0
"Je deviens fou sur ce nouveau mode GTA (Ft. Amine, Kameto, …)",0
Il a failli se faire ban Twitch à cause de cette blague…,0
Juste Prix avec GMK: Un fruit ou un Cadeau de fou !,0
24h pour survivre à une invasion extra-terrestre,0
"S’il fait top 1, il remporte 100 000 euro ! (J’ai organisé la coupe de France de fortnite)",0
J’ai atomisé ces 2 streamhackeurs en plein tournois Fortnite (et on claque double top 1…),0
Je vous montre ma collection de chaussures de fou (All My Sneakers 2023),0
On trouve la technique ultime pour faire top 1 sur Fortnite avec Gotaga (ptdrrrr c’était hilarant),0
J’essaie de monter l’Everest sur Fortnite avec Amine ! (Je casse mon ordinateur…),0
J’invoque HamoudHabibi sur AmongUs et je fais une Masterclass ! (Avec les croûtons),0
Je me fait insulter par un daron de 50 ans devant 100 000 personnes,0
On fait top 1 sur la première map de Fortnite avec Gotaga ! (La nostalgie me fais pleurer…),0
Je réponds à vos question après 1 mois d’expédition… (il me reste 6 mois avant l’Everest),0
J’ai ramené un androïde dans mon studio ! (Michou se fait insulter) on fini Detroit Become Human !,0
"Si on fais pas le bon choix, ça sera la fin du monde (ft. Michou)",0
On découvre une secte secrète contrôlé par l&#39;intelligence artificielle (ft.Michou) !,0
"Une journée au GP explorer ! (Ft. Michou, Gmk, …)",0
On doit sauver le monde contre les intelligences artificielles (ft.Michou),0
Je découvre le Canyoning ! J’ai sauté de 10m de haut pour la première fois de ma vie !,0
"Je suis plus pote avec Amine, il m&#39;a trahi…",0
On doit s&#39;évader de prison avec Amine ! ( A Way Out ),0
10H pour finir Theforest II (La fin est catastrophique…) ft. Amine,0
Amine me fait passer pour un raciste…,0
Je quitte mon studio… (après 4 ans),0
2H pour finir le jeu le plus dur de 2023 ! (j&#39;ai reçu une suprise de zinzin...),0
Il se prend le plus gros râteau de sa vie en plein live,0
Il s’évanouit dans l’attraction la plus rapide d’Europe ! (C’était une dinguerie…),0
Dinor essaie de me Tazer (je me venge pendant le tournage de son clip),0
Je lui ai retourné le cerveau ! (Le moove à 200 IQ),0
Ce mec s’est fait BAN 48 ans sur Fortnite…,0
Squeezie me traite de pigeon...,0
Inoxtag - Comme dans GT (Clip officiel),0
Pourquoi j’ai fermé OneCube ? (la fin d’un de mes plus gros projet),0
