title,is_informative
Creating modules | Intro to CS - Python | Khan Academy,1
Introduction to hands-on science activities,1
Hands-On Science with Khan Academy  #KhanAcademyScience #HandsOnLearning #STEM #shorts #khanacademy,1
Volume of rectangular pyramids using cubes | Grade 7 (TX TEKS) | Khan Academy,1
Volume of rectangular pyramids using rectangular prisms | Grade 7 (TX TEKS) | Khan Academy,1
Texas Teachers! Here&#39;s how to use TEKS-aligned unit guides on Khan Academy,1
Using text features to locate information | Reading | Khan Academy,1
Khan Academy Kids: Celebrating First Words Through First Grade,1
Guided meditation for students,1
"Shells, subshells, and orbitals | Atomic structure and properties | AP Chemistry | Khan Academy",1
Gini Coefficient and Lorenz Curve,1
Two-sample t test for difference of means | AP Statistics | Khan Academy,1
Monetary policy tools | Financial sector | AP Macroeconomics | Khan Academy,1
Federalism in the United States | US government and civics | Khan Academy,1
Introduction to vitamins and minerals | Biology foundations | High school biology | Khan Academy,1
Give to Khan Academy today!,1
The social contract | Foundations of American democracy | US government and civics | Khan Academy,1
Limit of sin(x)/x as x approaches 0 | Derivative rules | AP Calculus AB | Khan Academy,1
The US Constitution | Period 3: 1754-1800 | AP US History | Khan Academy,1
Industrialization and imperialism | World History | Khan Academy,1
Feudal system during the Middle Ages | World History | Khan Academy,1
Arian Controversy and the Council of Nicaea | World History | Khan Academy,1
Visual introduction to parabolas,1
Buddhism | World History | Khan Academy,1
Confucius and Confucianism,1
Golden age of Islam | World History | Khan Academy,1
Pre Columbian Americas  | World History | Khan Academy,1
Ancient Egypt | Early Civilizations | World History | Khan Academy,1
Ancient Mesopotamia | Early Civilizations | World History | Khan Academy,1
History and prehistory | The Origin of Humans and Human Societies | World History | Khan Academy,1
Fall of the Roman Empire | World History | Khan Academy,1
Zoroastrianism | World History | Khan Academy,1
Constrained optimization introduction,1
Sal teaches Grover about the electoral college | US government and civics | Khan Academy,1
Relative clauses | Syntax | Khan Academy,1
Run-ons and comma splices | Syntax | Khan Academy,1
Fourier Series introduction,1
"Rotational kinetic energy | Moments, torque, and angular momentum | Physics | Khan Academy",1
"Introduction to chemistry | Atoms, compounds, and ions | Chemistry | Khan Academy",1
Graphical limit at point discontinuity,1
Transcription and mRNA processing | Biomolecules | MCAT | Khan Academy,1
Evaluating composite functions: using graphs | Mathematics III | High School Math | Khan Academy,1
Faraday&#39;s Law example | Physics | Khan Academy,1
Flux and magnetic flux,1
Factoring quadratics as (x+a)(x+b) | Mathematics II | High School Math | Khan Academy,1
"What are terms, factors, and coefficients in algebraic expressions? | 6th grade | Khan Academy",1
Absolute value as distance between numbers | 7th grade | Khan Academy,1
Pixar in a Box | Welcome to Pixar in a Box | Khan Academy,1
Explicit &amp; recursive formulas for geometric sequences | High School Math | Khan Academy,1
Orders of magnitude exercise example 2 | Pre-Algebra | Khan Academy,1
How To Build The Future: Sam Altman,1
The Winter 2025 application deadline is in less than a week! Apply at ycombinator.com/apply.,1
The AI Future Has Arrived: Here&#39;s What You Should Do About It,1
The 10 Trillion Parameter AI Model With 300 IQ,1
You Don’t Have To Be A Billionaire To Launch Satellites,1
The &quot;overnight success&quot; of Kalshi,1
Why OpenAI&#39;s o1 Is A Huge Deal | YC Decoded,1
Starting A Company? The Key Terms You Should Know | Startup School,1
Now Anyone Can Code: How AI Agents Can Build Your Whole App,1
"Why Design Matters: Lessons from Stripe, Lyft and Airbnb",1
How Do Billion Dollar Startups Start?,1
Meta VS Apple: What Their Battle Means For AI Startups,1
The best consumer companies incorporate both virality and network effect to grow organically.,1
Why Vertical LLM Agents Are The New $1 Billion SaaS Opportunities,1
Stripe Head of Design Katie Dill Reviews Startup Websites,1
How To Find A Co-Founder | Startup School,1
What Founder Mode Really Means,1
"Once you identify the problem and fix it, you can always launch again.",1
Building The World&#39;s Best Image Diffusion Model,1
Signs Your Company Is Recovering From ZIRP,1
Y Combinator co-founder Jessica Livingston on the beginnings of YC.,1
New Defense Technology,1
How To Convert Customers With Cold Emails | Startup School,1
The Times When Paranoia Fueled Technological Advancement,1
How YC Was Created With Jessica Livingston,1
Over-complicated pricing could kill a sales process.,1
Why AI Hasn’t Blown Our Minds…Yet,1
How To Improve Cohort Retention | Startup School,1
Gmail creator Paul Buchheit on the very first version of Google’s “Did you mean?” feature,1
How To Live In The Social Media Matrix,1
Sales pre-PMF should be done by the founders.,1
Are We In An AI Hype Cycle?,1
How To Influence Decision Makers,1
We’re running a new YC batch this fall!,1
Co-Founder Equity Mistakes to Avoid | Startup School,1
How Nothing Founder Carl Pei Built A Multi-Million Dollar Smartphone Brand In Just 2 Years,1
"Gmail Creator Paul Buchheit On AGI, Open Source Models, Freedom",1
How To Price For B2B | Startup School,1
Tarpit Ideas: The Sequel,1
Don’t try to time the market. Try to build an enduring business.,1
Why Startup Founders Should Launch Companies Sooner Than They Think,1
"When you’re pre-product market fit, sales is a job for the founders.",1
Enterprise Sales | Startup School,1
The artistry is actually in that interface between the human and the technology itself.,1
"Zero Interest Rate Policy: Handled incorrectly, too much money can be poison.",1
You should probably still learn how to code.,1
10 People + AI = Billion Dollar Company?,1
"Better models, better startups.",1
What Is ZIRP And How Did It Poison Startups?,1
Standing Up For Startups - YC Goes To D.C.,1
Trump’s 2024 Election Win — and What’s Next | TED Explains the World with Ian Bremmer,1
Why You Think You Look Bad in Photos | Teri Hofford | TED,1
Democracy Is Being Tested. Citizen Assemblies Can Help | Ketakandriana Rafitoson | TED,1
What’s at Stake for the World | Ian Bremmer @TED #tedtalk,1
How AI Could Hack Democracy | Lawrence Lessig | TED,1
How to Defend Democracy — and Fight Autocracy | Leopoldo Lopez | TED,1
Networking Doesn’t Have to Feel Gross | Daniel Hallak | TED,1
Poetry and Music That Reaches Across the Digital Void | Elle Cordova | TED,1
Where Imagination Takes You,1
Utopias,1
Hope,1
Playfulness,1
Flow,1
Research,1
Curiosity,1
Inspiration,1
Failure,1
Childhood,1
What Is Imagination,1
Empathy,1
Rebellion,1
Makeover Illusion,1
Shame,1
Trolls,1
Dance,1
Hopes,1
Timekeeping,1
Running,1
Slow,1
Romance,1
Work,1
Slow Work,1
Slow Thinking,1
Connect,1
Family,1
Slow Spaces,1
Slow for Others,1
Leisure,1
Finish,1
Layover,1
Quantity and Quality,1
Linear,1
Master,1
Lifequakes,1
Shed,1
Create,1
Accept,1
Mark,1
Superpower,1
Rites,1
Drain the Oceans: Raiders of America | MEGA EPISODE | National Geographic,1
This is how one of the first nature documentaries came about.,1
Mark Wiens Goes Night Fishing and Jungle Foraging in Remote Thailand | Epic Food Journeys | Nat Geo,1
America&#39;s Wild West: A Catastrophic Frontier (Full Episode) | What Really Happened,1
Curse of the Mummy (Full Episode) | Lost Treasures of Egypt,1
"Drugs, Guns, and Marriage Fraud (Full Episode) | To Catch a Smuggler",1
"🔴 LIVE: Cocaine, Contraband, and Cartel Money: To Catch a Smuggler | S3 FULL EPISODES | @NatGeo",1
Edge of the Unknown with Jimmy Chin | Official Trailer | National Geographic,1
The Hills Have Eyes (Full Episode) | Dead By Dawn,1
Extreme Prep Edition (Full Episode) | Doomsday Preppers,1
I Suggest We Run (Full Episode) | Doomsday Preppers,1
Into the Spider Hole (Full Episode) | Doomsday Preppers,1
Nine Meals Away from Anarchy (Full Episode) | Doomsday Preppers,1
Clan of the North (Full Episode) | Kingdom of the Polar Bears,1
Friends Can Become Enemies (Full Episode) | Doomsday Preppers,1
It&#39;s All Gonna Hit the Fan (Full Episode) | Doomsday Preppers,1
Of the Land (Full Episode) | BRAND NEW SERIES | Life Below Zero: First Alaskans,1
Taking the World Stage (Full Episode) | North Korea: Inside the Mind of a Dictator,1
We Feed People | Official Trailer | Disney+,1
Dictator&#39;s Dilemma (Full Episode) | North Korea: Inside the Mind of a Dictator,1
Counterfeiting (Full Episode) | Trafficked with Mariana Van Zeller,1
Fentanyl (Full Episode) | Trafficked with Mariana Van Zeller,1
Explorer: The Last Tepui Trailer | National Geographic,1
Scams (Full Episode) | Trafficked with Mariana Van Zeller,1
Apocalypse (Full Episode) | The Story of God with Morgan Freeman,1
Bin Laden&#39;s Hard Drive | Full Episode,1
Why Does Evil Exist? (Full Episode) | The Story of God with Morgan Freeman,1
Rethinking Our Relationship With Water | National Geographic,1
Channing Tatum in the Mountains of Norway (Full Episode) | Running Wild with Bear Grylls,1
Protecting the Okavango Ecosystem | National Geographic,1
Conjoined Twins Separated | National Geographic,1
How Dating Scams Work | Trafficked with Mariana van Zeller,1
How Pharaohs Projected Divine Power | Lost Treasures of Egypt,1
Limitless with Chris Hemsworth | Official Trailer | Disney+,1
The Excavation of Tutankhamun’s Mummy | King Tut in Color,1
Surviving Prison in Thailand | Locked Up Abroad,1
Tutankhamun&#39;s True Burial Chamber  | Lost Treasures of Egypt,1
Meth Smuggling Model | Locked Up Abroad,1
Making an Undercover Drug Bust  | Locked Up Abroad: Declassified,1
Gordon Cooks Whitefish | Gordon Ramsay: Uncharted,1
Helping to Protect the Okavango Basin | National Geographic,1
Gordon Eats Honey Ants | Gordon Ramsay: Uncharted,1
Gordon Bakes Using a Hot Spring  | Gordon Ramsay: Uncharted,1
How the Kushites Took Over Egypt | Flooded Tombs of the Nile,1
Gordon Makes Smoked Fish Sausage | Gordon Ramsay: Uncharted,1
Deterring Sharks With an Electric Field  | Shark Attack Files,1
Gordon Makes Hominy | Gordon Ramsay: Uncharted,1
Global Water Wars (Full Episode) | Parched,1
Dian Fossey Secrets in the Mist: Murder on the Mountain (Full Episode),1
A String of Shark Attacks in San Diego | When Sharks Attack,1
"How Safe Are Food Preservatives, Really?",1
You Are Traveling at the Speed of Light Right Now,1
Why Can&#39;t We Use Lightning for Electricity?,1
"Sex, Spider Attacks, and Other Acts Caught in Amber",1
These Islands Shouldn&#39;t Exist,1
The World&#39;s First True Computer Still Hasn&#39;t Been Built,1
The Tiny Reasons This Island Is Shrinking,1
The JWST Pictures You Haven’t Seen Yet,1
This is Weird but...COVID Decreased Lightning Strikes,1
How Can a Saw Know What It’s Cutting?,1
How Shoulders Took Over the World (ft. Emily Graslie!),1
Is Spider Silk the Future of Material Engineering?,1
"How Old Are You? Well, Your Liver Is 3",1
Why’d the Ocean Stop Getting Saltier?,1
The Absolute Worst Thing About Butterflies,1
5 Ways Humans Are Influencing Species Evolution,1
How We Learn About Ancient History Using Carbon | Carbon Dating Compilation,1
What’s Up With the Weird Pockmarks Up and Down the East Coast?,1
Does Smoke Truly Follow Beauty? Science Explains,1
What Science Reveals about Shipwreck Graveyards,1
Why Genetic Engineering Can’t Do Everything (Yet),1
4 Skills Humans Have Lost Over Time,1
Your Bones Do More Than You Think,1
An Alzheimer’s Drug That Doesn’t Treat Alzheimer’s?,1
5 Mysteries Science Created and Solved,1
Is Long COVID Real? What We Know So Far,1
Why Do Our Eyes Move When We Think?,1
Why the Oceans Are Getting Darker,1
Are We Finally on the Road to Fusion Power?,1
Do Animals Have Sex for Pleasure?,1
Can Your Cat Change Color?,1
5 Things We Can Learn From Alaska,1
How to Avoid Corpse-Flavored Water,1
Why Do Itches Make You Chase Them?,1
5 Ways to Use Your Body as a Charger,1
Your Brain Once Had a Superpower. Could You Get It Back?,1
4 Mysterious Extinctions from Earth’s History,1
Why Is It so Hard to Swat a Fly?,1
Is the Power Grid Ready for Green Energy?,1
Why Does the US Have So Many Power Outages?,1
"SPNs Might Change the World, So What Are They?",1
These Ancient Footprints Changed History as We Know It,1
How Did North America End Up With a Marsupial?,1
Can You Get a Sunburn Behind a Window?,1
Which Seafood Is Better for the Environment: Farmed or Wild Caught?,1
The 4 Greatest Mysteries of Physics,1
How Antihistamines May Solve Your Problems,1
Tracking Plant Genetics Through Art,1
Can You Bamboozle Birds With Magic?,1
Can Seaweed Save the World?,1
"Where Did Democracy Come From, and Does It Still Work?",1
"Sacrifice, Redemption, and Miracles: The Story of Christianity: Crash Course Religions #9",1
Crash Course Political Theory Preview,1
What&#39;s the Difference Between Cults and Religion?: Crash Course Religions #3,1
What&#39;s the Difference Between Art &amp; Design?,1
Animal Behavior: Why This Toad Is Bad at Jumping: Crash Course Biology #49,1
How Does Art Tell Stories? : Crash Course Art History #7,1
The History of Museums: Crash Course Art History #3,1
Genetic Traits: Nature? Nurture? Not That Simple: Crash Course Biology #32,1
Intro to Genetics: Why Your Cat Looks Like That: Crash Course Biology #31,1
The Unexpected Truth About Water: Crash Course Biology #21,1
Conservation Biology: Sixth Mass Extinction?: Crash Course Biology #10,1
Intro to Ecology: Why Did All These Elephants Die?: Crash Course Biology #5,1
Plant Cells &amp; Hormones: Crash Course Botany #3,1
The Future of Public Health: Crash Course Public Health #10,1
How the Environment Affects Your Health: Crash Course Public Health #3,1
What is Public Health? Crash Course Public Health #1,1
Your Mental Health in College | How to College | Crash Course,1
Women and the Black Power Movement: Crash Course Black American History #40,1
How to Choose a Major | Crash Course | How to College,1
How to Pay for College | Crash Course | How to College,1
How to Apply to College | How to College | Crash Course,1
Medicinal Chemistry and Penicillin Total Synthesis: Crash Course Organic Chemistry #50,1
"Martin Luther King, Jr: Crash Course Black American History #36",1
How to Prepare for College | How to College | Crash Course,1
Sustainable Cities: Crash Course Geography #49,1
How to Choose a School | How to College | Crash Course,1
The Montgomery Bus Boycott: Crash Course Black American History #35,1
To College or Not To College | Crash Course | How to College,1
What is Urban Planning? Crash Course Geography #47,1
Biochemical Building Blocks &amp; Fischer and Haworth Projections: Crash Course Organic Chemistry #48,1
Why are People Moving to Cities? Crash Course Geography #45,1
School Segregation and Brown v Board: Crash Course Black American History #33,1
The Tuskegee Experiment: Crash Course Black American History #29,1
Political Thought in the Harlem Renaissance: Crash Course Black American History #27,1
Arts and Letters of the Harlem Renaissance: Crash Course Black American History #26,1
Where and Why Do People Move? Crash Course Geography #32,1
Booker T. Washington and W.E.B DuBois: Crash Course Black American History #22,1
Plessy v Ferguson and Segregation: Crash Course Black American History #21,1
How Do We Know We&#39;re Sick? Crash Course Outbreak Science #6,1
Ida B. Wells: Crash Course Black American History #20,1
What is Human Geography? Crash Course Geography #28,1
Reconstruction: Crash Course Black American History #19,1
Why Do We Have Fewer Outbreaks? Epidemiological Transition: Crash Course Outbreak Science #3,1
Natural Hazards: Crash Course Geography #27,1
Black Americans in the Civil War: Crash Course Black American History #18,1
Frederick Douglass: Crash Course Black American History #17,1
The Underground Railroad: Crash Course Black American History #15,1
The Rise of Cotton: Crash Course Black American History #13,1
Women&#39;s Experience Under Slavery: Crash Course Black American History #11,1
Large Bipartite Subgraph,1
Threshold for a Random Graph to Contain a Triangle,1
Linearity of Expectations,1
Bounded Differences Inequality (aka Azuma-Hoeffding Inequality),1
AI 101 with Brandon Leshchinskiy,1
The Next Generation of OCW is Here!,1
Part 6: Finding the Nullspace: Solving Ax = 0 by Elimination,1
I believe in OpenCourseWare’s mission,1
"1. Introduction, Finite Automata, Regular Expressions",1
"3. Regular Pumping Lemma, Conversion of FA to Regular Expressions",1
"4. Pushdown Automata, Conversion of CFG to PDA and Reverse Conversion",1
9. Breadth-First Search,1
Introduction to Algorithms - Problem Session 1: Asymptotic Behavior of Functions and Double-ended...,1
"15. Dynamic Programming, Part 1: SRTBOT, Fib, DAGs, Bowling",1
12. Carbohydrates/Introduction to Membranes,1
L0.1 Introduction to Nuclear and Particle Physics: Course Overview,1
1. Introduction (Intro to Solid-State Chemistry),1
21. X-ray Diffraction Techniques I (Intro to Solid-State Chemistry),1
Class 1: Intro and Key Technological Trends Affecting Financial Services,1
"14. Causal Inference, Part 1",1
1. What Makes Healthcare Unique?,1
1. Introduction and the geometric viewpoint on physics.,1
2. Introduction to tensors.,1
Lecture 1.1: The Molecules of Life — Representing Molecules,1
1. Introduction and Supply &amp; Demand,1
8. Competition II,1
23. Market Failures I: Externalities,1
11. Monopoly I,1
3. Budget Constraints and Constrained Choice,1
20. Uncertainty,1
19. International Trade: Welfare and Policy,1
2. Preferences and Utility Functions,1
6. Costs,1
4. Demand Curves and Income/Substitution Effects,1
10. Welfare Economics,1
9. Supply and Demand &amp; Consumer/Producer Surplus,1
23. Market Failures I: Externalities,1
25. Health Economics,1
5. Production Theory,1
15. Input Markets I—Labor Market,1
7. Competition I,1
14. Oligopoly II,1
1: Course Overview and Ionic Currents - Intro to Neural Computation,1
1. Artificial Intelligence and Machine Learning,1
1. A bridge between graph theory and additive combinatorics,1
"1. Introduction, Course Organization of MIT 7.016 Introductory Biology, Fall 2018",1
6. Nucleic Acids,1
"3. Structures of Amino Acids, Peptides, and Proteins",1
2. Chemical Bonding and Molecular Interactions; Lipids and Membranes,1
7. Replication,1
"The Queen will “mark the occasion privately at home”, Buckingham Palace said. #BBCNews",1
Pakistan railway bomb blast kills at least 25 | BBC News,1
Watch moment car explodes on a quiet residential New York street. #Explosion #NewYork #BBCNews,1
Nancy Pelosi blames Joe Biden for Democrats’ election loss | BBC News,1
Iran accused of Trump assassination plot - 3 men charged | BBC News,1
US charges man over alleged Iranian plot to kill Donald Trump | BBC News,1
Amsterdam attacks on Israel football fans condemned by mayor | BBC News,1
"It&#39;s been the hardest year of my life, says Prince William | BBC News",1
COP29 chief exec filmed promoting fossil fuel deals | BBC News,1
Donald Trump projected to win Nevada and appoints chief of staff | BBC News,1
"Israeli football fans attacked in Amsterdam, officials say | BBC News",1
Putin congratulates Trump on election victory and say he’s ready to talk | BBC News,1
BBC News given rare access to the Beirut area worst-hit by Israel. #Hezbollah #Israel #BBCNews,1
Australia plans social media ban for under-16s. #Australia #BBCNews,1
Protests in Israel after PM Netanyahu fires defence minister | BBC News,1
Joe Biden addresses nation from White House after Trump&#39;s election win | BBC News,1
Kamala Harris supporters react to loss as Donald Trump plans cabinet | BBC News,1
Germany&#39;s coalition collapses after chancellor fires minister | BBC News,1
"Trump Victory - What it means for Ukraine, Middle East, Russia, China and Europe | BBC News",1
Kamala Harris said &#39;we must accept the results of this election&#39;. #KamalaHarris #BBCNews,1
Kamala Harris said &#39;the light of America will always burn bright&#39;. #KamalaHarris #BBCNews,1
Kamala Harris delivers concession speech after Donald Trump’s US election win | BBC News,1
Republicans retake control of US Senate | BBC News,1
Bitcoin value increases after Trump win. #Bitcoin #Crypto #BBCNews,1
"What Donald Trump&#39;s win means for Ukraine, Middle East, Russia and UK | BBC News",1
What could Elon Musk gain from a Donald Trump presidency? #BBCNews,1
What a Trump win means for the Middle East. #Shorts #BBCNews,1
How Donald Trump made an ‘extraordinary’ political comeback | BBC News,1
Supporters leave Kamala Harris HQ early. #Shorts #USElection #BBCNews,1
Donald Trump wins US presidential election | BBC News,1
Fox News projected that Donald Trump won the election. #Shorts #BBCNews,1
How US election night unfolded | BBC News,1
Donald Trump: ‘God spared my life for a reason’ #Shorts #USElection #BBCNews,1
US election: Donald Trump declares victory | BBC News,1
Donald Trump declares victory in US presidential election. #USElection #DonaldTrump #BBCNews,1
US election: Trump projected to win Pennsylvania | BBC News,1
US election: Trump projected to win Georgia as crowds leave Harris HQ | BBC News,1
US election: Donald Trump projected to win North Carolina in first swing state result | BBC News,1
US election: Fake bomb threats in swing states  linked to Russian source | BBC News,1
US election: First polls close as Trump and Harris pick up early wins | BBC News,1
When do we find out who&#39;s won the US election? #USElection #KamalaHarris #DonaldTrump #BBCNews,1
Who are the US election candidates? | BBC News,1
How Kamala Harris and Donald Trump&#39;s US election campaigns unfolded | BBC News,1
US election day voting begins | BBC News,1
What happens if Kamala Harris and Donald Trump both get 269 electoral votes? #USElection,1
Mystery fires were Russian &#39;test runs&#39; to target cargo flights to US | BBC News,1
More flooding hits Spain as at least 217 people confirmed dead | BBC News,1
Hospital remains open in evacuated Lebanese city amid Israeli attacks | BBC News,1
Why are swing states so important in the US election? #US #SwingStates #Election #BBCNews,1
Torrential rains hit Spain as troops search for more flood victims in Valencia | BBC News,1
How powerful will Donald Trump be?,1
Look at who’s talking: divining Trump’s Middle East plans,1
Meet America’s next vice-president,1
Did Hispanic men help Trump win?,1
Do the after math: how Trump won,1
Will Trump’s victory make the world more dangerous?,1
Don of a new age: Trump’s decisive win,1
Election results: a brief message from John Prideaux,1
Vote! Our election-day special,1
US election: what to watch out for on the night,1
How could Harris beat Trump?,1
Last-ditch pitch: America’s campaigns conclude,1
Who does China want to win the US election?,1
Turn up the PA: the last in our swing-state series,1
Why The Economist is endorsing Kamala Harris,1
Tax driver: Labour’s budget,1
What do you call your wife’s brother’s wife?,1
Hot shot: the wider promise of weight-loss jabs,1
Will Americans trust the outcome of the 2024 election?,1
Ukraine reaction: Russia deploys North Koreans,1
Have Harris’s policies been “Trumpified”?,1
Timed bombs: Israel’s pre-election attack on Iran,1
The Weekend Intelligence: The Apology,1
Follow the leader: who will run Hamas?,1
Coming up Trump: our election model puts Harris behind,1
Left field: a new force in German politics,1
Marching borders: what was Hizbullah’s plan?,1
The history of Taiwan’s relationship with China,1
Spies isn’t everything: Putin’s global-chaos machine,1
Which language takes the longest to learn?,1
Leaderless: the death of Yahya Sinwar,1
Will young people let democracy die?,1
Ukraine’s drone army is transforming war,1
Mapping Putin’s covert war in Europe,1
Keir eye for the FDI: an interview with Britain’s PM,1
Will both the House and Senate flip?,1
"One giant, cheap for mankind: SpaceX’s Starship",1
Labour’s love lost: Keir Starmer’s first 100 days,1
Did Olena Zelenska really go on a $1m shopping spree in New York?,1
Paradise lost: Hurricane Milton bashes Florida,1
Google’s lurch: how to fix its monopoly,1
What will Trump do if he loses the US election?,1
General rule: how to reinvent America’s army,1
Year of destruction: how October 7th shattered the Middle East,1
The Weekend Intelligence: Black boxes (part one): Michael Kovrig on how he became a political...,1
A key Keystone: the race for Pennsylvania,1
October 7th: How one year reshaped the Middle East,1
The arc of war: a bloody week in Lebanon,1
Yuan for the money: China stimulates its economy,1
What are Donald Trump&#39;s policies?,1
"On These Questions, Smarter People Do Worse",1
The Strange Physics Principle That Shapes Reality,1
The real science of black holes,1
We Might Find Alien Life In 2324 Days,1
The Wondrous World of Thermite,1
How do QR codes work? (I built one myself to find out),1
Exposing The Flaw In Our Phone System,1
What Everyone Gets Wrong About Planes,1
Why Democracy Is Mathematically Impossible,1
What Do You Hear?,1
These Illusions Fool Almost Everyone,1
The Real Reason Robots Shouldn’t Look Like Humans | Supercut,1
Why People Prefer More Pain,1
What Jumping Spiders Teach Us About Color,1
This phone trick is IMPOSSIBLE,1
The Terrifying Real Science Of Avalanches,1
Something Strange Happens When You Follow Einstein&#39;s Math,1
The most dangerous problem in math,1
How bikes *actually* work,1
"I call this the &#39;No, You Don&#39;t&#39; Law",1
Congress is about to make a huge mistake for astronomy #SaveChandra,1
Why is this number everywhere?,1
How Japanese Masters Turn Sand Into Swords,1
I buried myself in concrete to explain how it works,1
The Oldest Unsolved Problem in Math,1
The Trillion Dollar Equation,1
World&#39;s strongest magnet!,1
