title,is_informative
How Far Can You Travel in 24 Hours,0
SIDEMEN GIANT BOX OF LIES,0
SIDEMEN YOU LAUGH YOU LOSE: IRL,0
SIDEMEN ABANDONED IN IRELAND CHALLENGE,0
THE CHASE: SIDEMEN EDITION,0
KIDS &amp; GRANDPARENTS BRUTALLY RATE THE SIDEMEN,0
SIDEMEN EXTREME HOME MAKEOVER,0
SIDEMEN AMONG US COOKING CHALLENGE,0
20 WOMEN VS 2 SIDEMEN: ANGRY GINGE &amp; DANNY AARONS EDITION,0
SIDEMEN vs 40 YOUTUBERS ULTIMATE HIDE &amp; SEEK IN A STADIUM,0
THE GREATEST SIDEMEN MOMENTS 2023,0
"SIDEMEN $100,000 VS $100 CHRISTMAS MOVIE",0
SIDEMEN SPLIT OR STEAL 2,0
SIDEMEN WORLD&#39;S HARDEST FOOD CHALLENGE,0
SIDEMEN BREAK THE WEIRDEST WORLD RECORDS,0
SURFING IN CHOCOLATE WATER!! #POVSurfing #Surfing,0
COME SURF WITH ME! *NEW BOARD* #Surfing #AcePro2 #Insta360 #POVSurfing,0
SURFING IN MAGIC CONDITIONS! #surfing #satisfying #povsurf,0
SURFING IN CHOCOLATE WATER! (RAW POV),0
POV SURFING WITH THE NEW INSTA360 ACE PRO 2! (SURF &amp; REVIEW),0
SURFING FLAWLESS WAVES! (RAW POV) *DREAMY CONDITIONS*,0
POV SURFING IN 360°,0
POV NIGHT SURFING AT URBNSURF WAVE POOL! (EPIC TUBES &amp; AIRS),0
POV: COME SURFING WITH ME! (PERFECT WAVES),0
POV SURFING PERFECT WAVES UP THE COAST! (Insta360 X4 Review),0
You could almost DRINK this Ocean Water! #surfing #satisfying,0
SURFING A NEW BOARD IN CLEAN BEACH BREAK WAVES! (RAW POV),0
AS GLASSY AS IT GETS 💎,0
Surfing over CRAZY Rocks!!!,0
SURFING UP THE COAST: ROCK DODGING ON A MID-LENGTH! (RAW POV),0
My LIVE Encounter with a SHARK in the Surf! #sharkencounter,0
FaZe Up inside a TUBE! ​⁠@FaZeClan  #fazeup,0
SURFING UP THE COAST ON A SICK NEW SWALLOW TAIL! (RAW POV),0
"MY COMPLETE SURFING SETUP: QUIVER, GEAR &amp; ROUTINES!",0
SURFING PUMPING OVERHEAD &amp; OFFSHORE WAVES! (RAW POV),0
SURFING SYDNEY&#39;S NEW URBNSURF WAVE POOL! (Ultimate POV Experience &amp; VLOG),0
IN THE TUBE AT URBNSURF SYDNEY!,0
SURFING IN THE MOST PRESTIGIOUS SURF COMP IN AUSTRALIA! (VLOG),0
This video has 50M+ VIEWS on Instagram,0
SURFING AN INSANE REEF BREAK! *with KAI NOA* (RAW POV),0
SURFING WITH A PRO SURFER! *WSL* (RAW POV),0
POV: Air Reverse in PRISTINE Waves 💎,0
POV: A Surfer’s Dream…,0
That NEW Surfboard Feeling 🥰,0
SURFING A DANGEROUS NEW WAVE! *SHALLOW REEF* (RAW POV),0
SURFING IN POURING RAIN! *SATISFYING ASMR* (RAW POV),0
SURFING MINI A-FRAME TUBES UP THE COAST! (RAW POV),0
TERRIFYING SHARK ENCOUNTER: THE SCARIEST SURF OF MY LIFE!! (RAW POV SESSION),0
HOW TO REMOVE WATER DROPS FROM GOPRO LENS! 💦,0
SURFING MAGIC WAVES UP THE COAST! (RAW POV),0
SURFING A BRAND NEW 5&#39;4 MICK FANNING SOFTBOARD! (RAW POV),0
SURFING WITH ERIN BROOKS &amp; WSL SURFERS!! (POV SURF VLOG),0
TESTING BOARDS WITH PRO SURFERS!! (POV SURF VLOG),0
HOW TO PUT FINS IN A SURFBOARD! (SECRET TIP),0
SURFING WITH THE BOYS: HUGE AIRS &amp; FOLLOW CAMS! (SURF VLOG),0
HOW TO REMOVE WAX FROM A SURFBOARD!,0
HOW TO WAX A SURFBOARD! (LIKE A PRO),0
SURFING INSANELY GLASSY WAVES... ALONE!! (RAW POV),0
SURFING AT BONDI BEACH! FULL POV EXPERIENCE (SURF VLOG),0
SURFER GETS A RAINBOW BARREL!,0
SURFING INTO ROCKS AT A NOVELTY LEFT! (RAW POV),0
SURFING A GLASSY POINT BREAK IN OZ! (4K POV),0
HOW SURF COACHING WORKS | IN-PERSON,0
SURFING GLASSY WAVES IN AUSTRALIA! (RAW POV),0
SURFING A CRYSTAL CLEAR BEACH BREAK! (RAW POV),0
Tokyo | La culture urbaine de demain | ARTE,1
Le jeu vidéo m&#39;a tout appris | Jour de play | ARTE,1
USA : Immersion dans un bastion trumpiste | ARTE Reportage,1
Chine : la tribu des rats (2017) | ARTE Reportage,1
Comment l’Europe fait-elle face aux inondations ? | ARTE Europe l&#39;Hebdo,1
Kenya : l’offensive des moustiques | ARTE Reportage,1
Chypre : base arrière de la guerre à Gaza | ARTE Regards,1
USA : San Francisco malade du Fentanyl | ARTE Reportage,1
Israël : une jeunesse ultranationaliste | ARTE Reportage,1
Vive les microbes ! | Interview de Marie-Monique Robin | ARTE,1
"Hong-Kong, la magie des néons  | GEO Reportage | ARTE",1
USA élections : le péril jeune | ARTE Reportage,1
Chasseurs de fantômes et néo-sorcières | Twist | ARTE,1
Qui sont nos véritables ancêtres ? | 42 - La réponse à presque tout | ARTE,1
La Russie cherche-t-elle à déstabiliser l’Europe ? | ARTE Europe l’Hebdo,1
Obésité : la molécule qui change tout | Décryptage | ARTE,1
À l&#39;assaut de l&#39;Everest | ARTE Regards,1
Comment la laïcité a-t-elle changé le monde ? | Les idées larges | ARTE,1
"Orages, grêle et pluies : ça se précipite ! | ARTE",1
Yeonpyeong : dans l’étau des deux Corée | ARTE Reportage,1
Que nous veulent les fantômes ? | Les idées larges | ARTE,1
Guantánamo : une mauvaise base ? | ARTE Reportage,1
Indonésie : adieu Jakarta | ARTE Reportage,1
White Power | Au cœur de l&#39;extrême droite européenne | ARTE,1
"Le système immunitaire, un puissant gardien | ARTE",1
Emirats : la fin de l&#39;Eldorado ? (2020) | ARTE Reportage,1
Japon : l’ombre de la guerre | ARTE Reportage,1
Corée du Nord : les hommes des Kim (Prix Albert Londres 2018) | ARTE Reportage,1
Irak : la frontière interdite (2021) | ARTE Reportage,1
Nigeria : le fléau des enlèvements | ARTE Reportage,1
Le rêve d’avoir (ou pas) un enfant | Twist | ARTE,1
Italie : Exploitation ou Esclavage ? | ARTE Regards,1
USA : le mur des coyotes | ARTE Reportage,1
Pourquoi se dispute-t-on avec ceux qu&#39;on aime ? | Les idées larges | ARTE,1
Chine : naître et ne pas être (2014) | ARTE Reportage,1
"Le climat, nouvelle ligne de fracture | L&#39;Europe dans l’œil du cyclone avec Jean-Yves Dormagen |ARTE",1
Israël : borderlines | ARTE Reportage,1
Brésil : le clown de Cracolandia | ARTE Reportage,1
Tout quitter pour vivre sur l’île de La Gomera (2018) | ARTE Regards,1
Côte d’Ivoire : haro sur le cacao | ARTE Reportage,1
Iran-Israël : la prudence des voisins arabes | Décryptage | ARTE,1
Comment vivre &quot;simplement&quot; ? | Twist | ARTE,1
Sénégal : chronique d’un basculement | ARTE Reportage,1
Le sucre nous rend-il bêtes ? | 42 - La réponse à presque tout | ARTE,1
Sommes-nous trop nombreux sur Terre ? | 42 - La réponse à presque tout | ARTE,1
Pauvre et sans-abri dans un pays riche  | ARTE Regards,1
"RDC : M23, la guerre sans fin | ARTE Reportage",1
Emmanuel Macron &quot;met un vent&quot; à un salarié ? #Politique #MacronCherbourg #Désintox #ARTE,1
Moche et sexy | Twist | ARTE,1
Et si on était payé à ne rien faire ? | Les idées larges | ARTE,1
"Espagne : des pluies torrentielles à Cadaqués, en Catalogne • FRANCE 24",1
Crise politique en Allemagne : le chancelier Olaf Scholz sur un siège éjectable • FRANCE 24,1
"En pleine crise politique, l&#39;Allemagne célèbre les 35 ans de la chute du mur de Berlin",1
Liban : plusieurs frappes israéliennes sur la banlieue sud de Beyrouth • FRANCE 24,1
L&#39;équipe de Donald Trump prépare le retrait de l&#39;accord de Paris sur le climat • FRANCE 24,1
"Sur les traces du thé sri lankais, des collines verdoyantes aux tasses du monde • FRANCE 24",1
"Vendée Globe : à 23 ans, elle va faire le tour du monde en solitaire • FRANCE 24",1
"Près de 70 % des morts à Gaza sont des femmes et des enfants, selon un décompte partiel de l&#39;ONU",1
Victoire de Donald Trump : une menace existentielle pour l&#39;Europe? • FRANCE 24,1
L’élection de Donald Trump ravive la désinformation pro-russe contre l’Ukraine • FRANCE 24,1
Ligue des champions : une nouvelle formule qui bouscule les habitudes • FRANCE 24,1
"Élection de Donald Trump aux États-Unis : de paria à président, la &quot;résurrection&quot; ?",1
"La &quot;Maison du futur&quot;, le projet Biosphère • FRANCE 24",1
Fabriquer en France : &quot;Il faudrait être un peu plus protectionniste&quot; • FRANCE 24,1
Assassinat de Samuel Paty : huit personnes devant la cour d&#39;assises spéciale de Paris • FRANCE 24,1
"Vendée Globe, 10e édition : six femmes au départ de la course en solitaire • FRANCE 24",1
Le Soudan lance sa campagne de vaccination contre le paludisme • FRANCE 24,1
La Guyane confrontée à une sécheresse extrême • FRANCE 24,1
Ce que l&#39;on sait des violences contre des supporters israéliens à Amsterdam • FRANCE 24,1
"Présidentielle américaine, le jour d’après : Donald Trump, la résurrection • FRANCE 24",1
Procès de l&#39;assassinat de Samuel Paty : auditions de la famille • FRANCE 24,1
Pierre Moscovici : &quot;Il se peut que les États-Unis essaient de prospérer sur les divisions de l’UE&quot;,1
#VladimirPoutine félicite #DonaldTrump pour son élection • FRANCE 24,1
La conviction intime d&#39;Elon Musk : l&#39;homme vit dans une simulation extraterrestre • FRANCE 24,1
"&quot;Donald Trump n&#39;est pas un va-t-en-guerre&quot;, estime l&#39;historien Justin Vaïsse • FRANCE 24",1
#Liban : le sort incertain des employées domestiques #africaines • FRANCE 24,1
Présidentielle américaine : autopsie de la débâcle des démocrates • FRANCE 24,1
Pays-Bas : violences contre des supporters israéliens en marge d&#39;un match de football • FRANCE 24,1
"&quot;Vu de Russie&quot; : les opposants à Vladimir Poutine se sont faits &quot;trumper&quot;, estime sa propagande",1
"Ukraine, Moldavie, Géorgie candidates à l’UE : élargir le club pour contrer la Russie ?",1
Lutte contre le terrorisme : l&#39;armée tchadienne se sent &quot;isolée&quot; • FRANCE 24,1
#Amsterdam : des #supporters israéliens agressés après un match de football • FRANCE 24,1
"Sénégal : &quot;Le populisme devient mode de gouvernance&quot;, selon Macky Sall • FRANCE 24",1
"Iran, les visages de la colère : plongée clandestine dans le quotidien de ceux qui disent non",1
Le grain de folie d&#39;Hélène in Paris • FRANCE 24,1
Ukraine: la guerre sans Trump ? • FRANCE 24,1
Allemagne : Olaf Scholz sur un siège éjectable • FRANCE 24,1
Au moins cinq Casques bleus blessés au Liban où Israël intensifie ses frappes • FRANCE 24,1
"Enquête sur les maternités SS : Lebensborn, la fabrique des aryens dans l&#39;Allemagne nazie",1
"Des supporters israéliens agressés à Amsterdam, Netanyahu envoie deux avions de secours",1
&quot;L&#39;étrange absence&quot; de Kylian Mbappé • FRANCE 24,1
Bakou connexion: enquête en France sur les intérêts des proches du régime • FRANCE 24,1
Etats-Unis : Joe Biden promet une &quot;transition pacifique&quot; avec son ennemi juré Trump • FRANCE 24,1
Etats-Unis : Donald Trump nomme Susie Wiles cheffe de cabinet de la Maison blanche • FRANCE 24,1
"&quot;Nous ne resteront pas inactifs&quot;, dit Gavin Newsom • FRANCE 24",1
PSG : un immense tifo en soutien à la Palestine déployé par les supporters • FRANCE 24,1
Sénégal : Macky Sall accuse ses successeurs d&#39;inaction et de &quot;manipulation&quot; • FRANCE 24,1
&quot;Blue Anon&quot; : quand les démocrates cèdent à la théorie du complot • FRANCE 24,1
Victoire de Donald Trump aux Etats-Unis : l&#39;Europe à l&#39;épreuve • FRANCE 24,1
Réélection de Donald Trump : le discours de Joe Biden • FRANCE 24,1
Violences à Amsterdam après un match de foot entre l&#39;Ajax et Tel-Aviv,1
Joe Biden s&#39;exprime après la victoire de Donald Trump,1
"Trump président, que va-t-il se passer ? On a répondu à vos questions #Replay #USA2024",1
Bruno Le Maire se défend de tout dérapage budgétaire,1
La nuit où Trump a gagné l&#39;élection présidentielle américaine,1
Trump réélu président des Etats-Unis 🚨 Suivez les résultats de l&#39;élection présidentielle USA 2024,1
USA 2024 : Trump revendique la victoire à la présidentielle américaine,1
Trump vs Harris : voici les premiers résultats de la présidentielle USA 2024,1
Les tout derniers meetings de Trump et Harris de la présidentielle américaine 2024,1
Iran : une étudiante proteste en sous-vêtements et est arrêtée,1
"A Washington, des milliers de femmes marchent pour leurs droits et pour Harris",1
"Kamala Harris aime dire du mal de Donald Trump, voici pourquoi",1
"En Espagne, dans les zones sinistrées, des milliers de volontaires viennent prêter main-forte",1
Présidentielle américaine : Jennifer Lopez appelle à voter Kamala Harris,1
Liban : les images de villages entièrement détruits par l’armée israélienne,1
Joe Biden se retire : les médias américains sous le choc,1
Israël - Palestine : voici ce que veut vraiment le Hamas,1
Macron dit pouvoir trouver « 10 offres d’emploi » en faisant « le tour du Vieux-Port » de Marseille,1
Nos forêts vont bientôt irrémédiablement changer,1
Wagner Leaks : les documents qui révèlent les mensonges de la Russie en Centrafrique,1
« MBS » reçu en grande pompe par Macron à l&#39;Elysée,1
"A Bakhmout, des soldats ukrainiens filment les combats",1
Pourquoi Elisabeth Borne a-t-elle échappé à la démission ?,1
Fonds Marianne : Marlène Schiappa tente d’esquiver face aux sénateurs,1
Incendies : peut-on empêcher les feux de forêt ?,1
Attaque à Annecy : les images de l’assaillant,1
"En Ukraine, la destruction d&#39;un barrage inonde plusieurs villes",1
Everest : « Quelqu’un peut te pousser et tu peux tomber »,1
Des étudiants d’HEC face à TotalEnergies et Shell,1
Pourquoi l&#39;Ukraine réclame-t-elle ces F-16 ?,1
Foot : ces insultes racistes font scandale en Espagne,1
Titanic : l’épave reconstituée en 3D grâce à 700 000 photos,1
Petit-neveu de Macron agressé : son père est « révolté »,1
IA : les limites de Midjourney selon ChatGPT ?,1
Etats-Unis : afflux massif de migrants à la frontière avec le Mexique,1
Comment Zelda a révolutionné le jeu vidéo en openworld (Ft. TheGreatReview),1
Shein : les dessous de la marque chinoise au succès fou,1
Turquie : cet homme est favori pour battre Erdogan à la présidentielle 2023,1
Les images de l&#39;attaque de drones sur le Kremlin,1
La discrimination capillaire pourrait bientôt être reconnue par la loi,1
"La France émet trop de CO2, voici comment (Ft. Le Réveilleur)",1
"Fonds Marianne, entre scandale et embarras du gouvernement",1
Allocution d’Emmanuel Macron : ce qu’il faut en retenir,1
Ouganda : l&#39;une des lois les plus répressives au monde envers les personnes LGBT+,1
Un officier russe raconte ce qu’il a vu de Vladimir Poutine,1
Sainte-Soline : comment le militant antibassine Serge D. a été gravement blessé | Enquête,1
Savez-vous reconnaître une image générée par une intelligence artificielle ?,1
Trottinettes électriques : pour ou contre les supprimer ?,1
"Après le 49.3, regain de mobilisation contre la réforme des retraites",1
Macron réagit à la contestation contre la réforme des retraites,1
Pourquoi il faut stopper le porno ! #addictionrecovery #nonutnovembermemes #santé,1
Datagaule et clitodonnées : le plaisir à la chaîne - #DATAGUEULE 85,1
C&#39;est quoi le chômage ? #chômage #travail #france,1
"Chômage, mirages, naufrages - #DATAGUEULE 90",1
C&#39;est quoi les impôts ? 🤔 #argent #impôts #france,1
"L’impôt, le peuple et le truand - #DATAGUEULE 86",1
LONGO MAÏ UKRAINE - UNE UTOPIE FACE AU CHAOS - TEASER,1
LA TERRE ET LE TRAVAIL - TEASER,1
LE MOUVEMENT DES SANS-TERRE - TEASER,1
OASIS DE PAIX - TEASER,1
ZAD PARTOUT - TEASER,1
SARAYAKU - TEASER,1
UTOPIE.S ? - TEASER - #DATAGUEULE,1
Handicap : le contrat social invalide (Version LSF) - #DATAGUEULE 97,1
Parentalités non hétéro : des genres qui dérangent - #DATAGUEULE 100,1
Violences policières : ensauvagement politique - #DATAGUEULE 99,1
La transition électrique : les doigts dans l&#39;emprise - #DATAGUEULE 98,1
"En attendant Utopie(s) ? #11 : Rojava, une utopie au cœur du chaos",1
Merci !,1
Utopie(s) ? Live : Le best of,1
La COGIP soutient Utopie(s) de datagueule,1
Utopies - Le bon gros live,1
Dernier appel avant embarquement,1
"En attendant Utopie(s) ? #10 : Utopies, le seul réalisme",1
"UTOPIES, MAINTENANT OU JAMAIS",1
Handicap : le contrat social invalide - #DATAGUEULE 97,1
"En attendant &quot;Utopie(s)?&quot; #9 - Les monastères, ces ZAD du Moyen-Âge",1
"En attendant &quot;Utopie(s)?&quot; #8 : Du familistère aux makers, l&#39;utopie en pratique",1
En attendant &quot;Utopie(s)?&quot; #7 : Un Google de papier pour la paix universelle,1
En attendant &quot;Utopie(s)?&quot; #6 - L&#39;utopie comme émancipation,1
Les sportifs féministes soutiennent Datagueule,1
"En attendant &quot;Utopie(s)?&quot; #5 - New Lanark, l&#39;usine à rêves",1
En attendant &quot;Utopie(s)?&quot; #4 - L&#39;urgence utopique,1
En attendant &quot;Utopie(s)?&quot; #3 - La civilisation de l&#39;Indus une utopie disparue ?,1
En attendant &quot;Utopie(s)?&quot; #2 - Une langue pour tous ?,1
En attendant &quot;Utopie(s)?&quot; #1 - La préhistoire au féminin,1
La compil&#39; des soutiens,1
#DATAGUEULE : DÉCONFINEMENT DES POSSIBLES,1
FAQ Utopie(s)? - DataGueule,1
#DATAGUEULE : UTOPIE(S) ?,1
Hôpital public : l&#39;optimisation à mort,1
CORONAVIRUS: CONFINEMENT IS SOLIDARITY,1
Coronavirus : confinements solidaires,1
Dette publique : austérité avec intérêts - #DATAGUEULE 96,1
Réseaux sociaux : flux à lier - #DATAGUEULE 95,1
Épisode 01 - Invisibles - Les travailleurs du clic (Bande annonce),1
&quot;Invisibles - Les travailleurs du clic&quot; (Bande annonce),1
Surpopulation : La peur aux ventres - #DATAGUEULE 94,1
Philanthropie : Le capital se fout de la charité - #DATAGUEULE 93,1
À feu et à sable - #DATAGUEULE 92,1
Que se passe-t-il (vraiment) dans les fils électriques ? 💡🔌⚡️,1
La physique des arcs-en-ciel,1
"Le système ELO, des échecs à l&#39;e-sport",1
Les photons existent-ils ? 🟡,1
L&#39;Algorithme qui Sécurise Internet (entre autres...),1
LENIA : Une nouvelle forme de vie mathématique !,1
Comment expliquer l&#39;expansion accélérée de l&#39;Univers ? [Ép. 2 Les théories],1
L&#39;EXPANSION ACCÉLÉRÉE de l&#39;UNIVERS [Ép. 1 : La découverte],1
SATURATION de l&#39;EFFET DE SERRE : Le réchauffement a-t-il atteint sa limite ?,1
Les CARTES MENTALES (mind map) : écrire et prendre ses notes autrement,1
MIEUX APPRENDRE &amp; ÉTUDIER : les (vraies) techniques scientifiques,1
Ces galaxies impossibles vont-elles bouleverser la cosmologie ?,1
La formule qui a radicalement transformé la finance mondiale [Black-Scholes],1
LE VERRE : Ce matériau étrange et méconnu réconcilie l&#39;art et la technologie...,1
Ce qui se cache derrière le fonctionnement de ChatGPT,1
Chats de Schrödinger &amp; Décohérence quantique,1
Les plus GRANDES structures de l&#39;Univers,1
Comment ces IA inventent-elles des images ?,1
Dans quoi l&#39;Univers est-il en expansion ? [La FAQ de l&#39;Univers],1
L&#39;INFLATION COSMIQUE,1
L&#39; (autre) EXPÉRIENCE FONDATRICE DE LA MÉCANIQUE QUANTIQUE 🧲 ⚛️,1
CETTE RÉACTION CHIMIQUE APPREND À SURVIVRE — Ma publication sur LYFE,1
LES SUPERPOSITIONS QUANTIQUES SONT-ELLES RÉELLES ?,1
LE TÉLESCOPE SPATIAL JAMES WEBB : Pourquoi ? Comment ?,1
LE PLUS GROS PROBLÈME de la Mécanique Quantique : La Mesure [FondementsQ #1],1
L&#39;EXPÉRIENCE INTERDITE : ⚡️Milgram &amp; la Soumission à l&#39;Autorité⚡️🔌,1
"LE SYNTHÉTISEUR, ou comment l&#39;électronique a changé la musique (ft. Scherzando)",1
Supraconducteurs &amp; Lévitation Magnétique 🧲⬆️,1
JE CRAQUE WORDLE ! 🟩⬛🟨⬛🟨 (grâce aux maths),1
LA COSMOLOGIE EN CRISE !? 🔥 Hubble sous tension,1
Comment Mesurer L&#39;Univers ? 🔭🌕☀️✨🌌,1
"L&#39;énergie du vide quantique, -1/12 et l&#39;effet Casimir",1
Comment les I.A. font-elles pour comprendre notre langue ?,1
LA THÉORIE DU BIG-BANG 💥,1
La technique secrète des physiciens,1
Krachs Boursiers &amp; Tremblements De Terre,1
Comment écrire les nombres ayant une infinité de décimales ?,1
Comment j&#39;essaye d&#39;améliorer mon jugement (grâce à Julia Galef et à FLUS),1
La génétique de l&#39;intolérance à l&#39;alcool,1
7 techniques pour détecter une exoplanète 🔭🌍 [Astrobiologie #4],1
Comment limiter la transmission aérienne du COVID ? 🦠➡️🪟,1
Comment déchiffrer (presque) n&#39;importe quel message codé ?  🔑🔓📜,1
Pourquoi dort-on ? Le mystère scientifique du sommeil,1
La Dualité Onde-Corpuscule,1
Le repliement des protéines : Résolu par l&#39;intelligence artificielle AlphaFold ?,1
Sommes-nous seuls dans l&#39;Univers ? — Le paradoxe de Fermi [Astrobiologie #3],1
Alain Aspect : Intrication quantique et inégalités de Bell [Interview complète],1
Les inégalités de BELL &amp; les expériences d&#39;Alain ASPECT,1
LYFE : la Thermodynamique de la Vie [Astrobiologie #2],1
Qu&#39;est-ce que la vie ? [Astrobiologie #1],1
Marie Curie - Un cran au-dessus des autres (de TOUS les autres),1
Tom Cruise - La dernière star d&#39;Hollywood,1
"L&#39;âge de la Terre, feat @sciencedecomptoir",1
"Paul Langevin - Jumeaux, potos et guerres mondiales...",1
La vérité sur le Q.I.,1
A quoi servent les biopics ?,1
La CIA est (MK) Ultra cringe - Quickie 29,1
Le bestiaire des particules - Quickie 28,1
Jean Perrin - Il a mis tout le monde d&#39;accord - LPPV 12,1
Encore des chansons qui nous mentent,1
Boltzmann - Vous allez enfin comprendre l&#39;entropie - LPPV 11,1
Les accélérateurs de particules - Quickie 27 - e-penser,1
Les hormones,1
3 projets ingénieux de la guerre froide - quickie 26 - e-penser,1
"La vidéo cachée du 1 avril 2024 - Weiss der geier feat. Florent Garcia, Aaron Lerer &amp; Franck Dunas",1
Les 3 artistes musicaux qui m&#39;ont le plus influencé,1
"Luminol, ou faire briller les preuves - quickie - 25",1
L&#39;incompréhensible article d&#39;Alan Sokal - quickie - 24,1
"C&#39;est de la recherche, ça ??? - quickie 23 - e-penser",1
La meilleure saga cinématographique,1
James Clerk Maxwell - Parmi les plus grands - LPPV.10 - e-penser,1
L&#39;idée la plus débile de la guerre froide ? - quickie 22 - e-penser,1
Richard Feynman - Le besoin de comprendre - LPPV.09 - e-penser,1
Le boson de Higgs feat @AstronoGeek - 51 - e-penser,1
Ces chansons qui nous mentent ft. @gontranh et d&#39;autres gens bons,1
Matrix Resurrections est-il un grand film ? (oui),1
Tommy - le monument du rock (partie 3),1
Tommy - Avec Jack Nicholson qui chante - si ! (partie 2),1
Le plus grand film Rock de tous les temps,1
Vers des essais cliniques 2.0,1
Ce simulateur peut vous sauver la vie !!!,1
Cool as ICE - Rien n&#39;émerge du néant,1
Roméo et Juliette - 01 - C&#39;est pas ce que vous croivez,1
Question de perception,1
"Christopher Nolan - Le fond, la forme et l&#39;invisible",1
Jacques Demy - Croire en la jeunesse,1
Le grand débat de la mauvaise foi : Steven Spielberg,1
Le grand débat de la mauvaise foi : Star Wars,1
Le groupe musical le plus influent des 50 dernières années - quickie 19 - e-penser (non censurée),1
"Mon 2e vol en Zéro G, feat. Thomas Pesquet",1
Le vaccin CoViD - feat Marie-Paule Kieny,1
Confinement 2.0 avec un infectiologue - partie 2,1
Confinement 2.0 avec un infectiologue - partie 1,1
L&#39;Ultime Expérience,1
Est-ce que tout s&#39;accélère... - quickie 21 - e-penser,1
La vidéo la plus utile de ma chaîne - quickie 20 - e-penser,1
Le groupe musical le plus influent des 50 dernières années - quickie 19 - e-penser (censuré),1
Vous n&#39;existez pas réellement - 50 - e-penser,1
Point sur le CoronaVirus avec Etienne Simon-Lorière,1
Un point sur le coronavirus SARS-COV2,1
77 SECRETS INCROYABLES sur les PRESIDENTS AMÉRICAINS !,1
7 LIEUX qui existent UNIQUEMENT sur des CARTES !,1
197 EXPLOITS HALLUCINANTS dans le MONDE !,1
7 LIEUX les plus ISOLÉS au MONDE !,1
77 VRAIS GUERRIERS LÉGENDAIRES !!,1
77 DÉCOUVERTES qui ont BOULEVERSÉ LE MONDE !,1
7 Pays qui N&#39;EXISTENT PAS !,1
77 FAITS INCROYABLES que tu IGNORAIS sur la FRANCE !!,1
7 Choses INCROYABLES qui ont 100 ANS AUJOURD&#39;HUI !,1
77 Légendes et Mystères des Mers et des Océans,1
50 Lieux HANTÉS et TERRIFIANTS aux ÉTATS-UNIS !,1
77 SECRETS sur les MONDES CACHÉS et SOUTERRAINS!,1
TIER LIST des PIRES Rois de France !,1
"Si t’as envie de partir à la chasse aux fantômes, direction ma dernière vidéo !",1
197 LIEUX HANTÉS DANS LE MONDE !,1
Connais tu ces phobies insolites ?,1
Patrick le Wombat,1
7 année-là : L’année 1990 !,1
7 LIEUX ABANDONNÉS et OUBLIÉS du monde !,1
"Naître par la bouche, c&#39;est quoi ça encore ?",1
Général Sherman à vos ordres !,1
Quelles sont ces 7 phobies ? C&#39;est l&#39;heure du quizz !,1
Un lac TOUT rose ?,1
Un bateau avec des ailes ? C&#39;est le pari de Michelin avec le projet WISAMO !,1
77 faits SURPRENANTS sur l’AMERIQUE DU SUD !,1
Un piano perché ??,1
L&#39;histoire folle de Donald Campbell,1
Le nasion,1
Le plus petit escargot au monde,1
De la semence en guise d&#39;encre ?,1
Une langue COMPLETEMENT sifflée ?,1
7 pays OUBLIÉS de TOUS !,1
77 faits INSOLITES sur la MYTHOLOGIE !,1
Testicules ou tubercules ?,1
Il s&#39;est passé quoi 7 année là : 2001 !,1
7 SECRETS SURPRENANTS et INCROYABLES sur les NOMBRES !,1
107 lieux MOCHES et très BIZARRES en France !,1
Tu connais le village des jumeaux ?,1
La face cachée du 7UP !,1
Le PREMIER Selfie du MONDE !,1
Tu me juges ?,1
77 SECRETS sur les plus GROSSES marques du MONDE !,1
Combien de fois MAXIMUM tu peux plier une feuille ?,1
La tuile... aux loups !,1
107 Faits INCROYABLES et SURPRENANTS en FRANCE !,1
Le métier le plus DANGEREUX du monde !,1
Combien valent les œuvres de Van Gogh ?,1
7 choses BANNIES dans le monde !,1
Le plus PETIT oiseau du monde ?,1
Le papier bulle était du papier peint ??,1
5 femmes dont on a volé le travail,1
Des milliers de Louis d&#39;Or retrouvés derrière un mur en plein Paris !,1
Le traitement du cancer en Égypte antique #Shorts,1
Notre nouveau livre Mythes et Légendes ! #Shorts,1
Pourquoi les élections américaines posent problème ?,1
Keanu Reeves et la promotion de la pseudo archéologie (Graham Hancock - A l&#39;aube de notre histoire),1
Une urne Viking qui n&#39;en est pas une #Shorts,1
Le barrage le plus résistant de France,1
Un bout de Pointe-à-Pitre ! #Shorts,1
Le labyrinthe du Minotaure retrouvé ? #Short,1
La véritable histoire de Belzébuth,1
La 3e Kamera #Shorts,1
