title,is_informative
Why It Was Almost Impossible to Make the Blue LED,1
I waterproofed myself with aerogel!,1
The Rainiest Place On Earth,1
Do People Understand The Scale Of The Universe?,1
"What Game Theory Reveals About Life, The Universe, and Everything",1
Inside Japan’s Earthquake Simulator,1
The SAT Question Everyone Got Wrong,1
The Surprising Genius of Sewing Machines,1
What The Ultimate Study On Happiness Reveals,1
How Do Night Vision Goggles Work? (There&#39;s 3 types),1
The Problem With Science Communication,1
How One Line in the Oldest Math Text Hinted at Hidden Universes,1
The Man Who Killed Millions and Saved Billions (Clean Version),1
Pushing The Limits Of Extreme Breath-Holding,1
How Close We&#39;ve Come to Nuclear War,1
The Insane Math Of Knot Theory,1
Should Airships Make A Comeback?,1
I Took an IQ Test to Find Out What it Actually Measures,1
The Real Story of Oppenheimer,1
The Hidden Science of Fireworks,1
The Most Misunderstood Concept in Physics,1
I Vacuum Venom from the World&#39;s Deadliest Spider,1
Something Strange Happens When You Keep Squaring,1
"PBS News Hour West live episode, Nov. 8, 2024",1
"PBS News Hour full episode, Nov. 8, 2024",1
New York fashion industry tries to preserve artisan craftwork as factories move overseas,1
Harris loss causes some to question what it will take to elect a woman president,1
Americans voters explain their election choices and discuss views on the future,1
News Wrap: Crews make progress fighting against Southern California wildfire,1
Police investigating what led to violence involving Israeli soccer fans in Amsterdam,1
WATCH LIVE: Returning SpaceX Crew-8 NASA astronauts discuss their mission in space,1
LIVE Q&amp;A: Answering your questions on the 2024 election,1
"PBS News Hour West live episode, Nov. 7, 2024",1
"PBS News Hour full episode, Nov. 7, 2024",1
Health officials concerned about RFK Jr.&#39;s influence in Trump administration,1
Ukraine loses ground to Russia as Trump win leaves future U.S. support in doubt,1
Trump’s return to White House upends criminal investigations and convictions he’s faced,1
News Wrap: Hurricane Rafael damages Cuba&#39;s already vulnerable power grid,1
Fed cuts interest rates amid questions over independence during next Trump administration,1
Control of House still in question as crucial races remain too close to call,1
"Biden touts accomplishments, calls for peaceful transition after Trump&#39;s election win",1
WATCH: Defense Secretary Austin holds briefing on transition of power after Trump election win,1
WATCH LIVE: Federal Reserve Chair Powell holds news conference following interest rate meeting,1
WATCH LIVE: Pentagon holds news briefing,1
WATCH LIVE: State Department holds news briefing,1
"WATCH: &#39;America endures,&#39; Biden says in first address after Trump victory",1
News Wrap: At least 30 dead after Israeli strike on residential building in Lebanon,1
"PBS News Hour full episode, Nov. 6, 2024",1
"GOP, Democratic strategists on what the results mean for their parties and the government",1
How world leaders are reacting to Trump&#39;s election win,1
Rep. Maria Salazar on why Trump&#39;s message resonated with so many Hispanic voters,1
How Trump built a new coalition to send him back to the White House,1
Where Trump won big and the important counties where Harris struggled to drive turnout,1
Harris urges supporters to &#39;never give up the fight for our democracy&#39; in concession,1
Trump prepares for White House return after decisive victory,1
"In concession, Harris vows peaceful transition",1
WATCH: Harris in concession speech urges supporters to fight for the ‘light of America’s promise’,1
"In concession, Harris promises, &#39;I will never give up the fight&#39; for Americans&#39; futures",1
How Trump’s victory affects his legal cases,1
WATCH: Election 2024 | PBS News special coverage,1
LIVE Q&amp;A: Breaking down Trump&#39;s 2024 presidential election victory,1
"LISTEN LIVE: Supreme Court hears case involving Facebook, the SEC and Cambridge Analytica",1
WATCH LIVE: McConnell speaks to reporters after Trump wins 2024 presidential election,1
"WATCH LIVE: Trump hosts election night watch party in West Palm Beach, Florida",1
WATCH: Trump makes victory speech in Florida,1
WATCH: Trump says he will fight for &#39;every citizen&#39;,1
WATCH LIVE: Harris hosts election night watch party at Howard University in D.C.,1
WATCH: Harris will not address crowd at Howard University on election night,1
WATCH: Schiff says he will be &#39;voice for all Californians&#39; after Senate win,1
"PBS News Hour full episode, Nov. 5, 2024",1
WATCH LIVE: North Carolina Attorney General Josh Stein speaks after winning election for governor,1
WATCH: North Carolina Lt. Gov. Mark Robinson concedes election after losing gubernatorial vote,1
WATCH: Republican Rep. Tom Cole says he’ll accept election results regardless of outcome,1
Can US shale really protect America from oil shocks? | FT Energy Source,1
How to retain your workforce | FT Working It,1
Can hydrogen help the world reach net zero?  | FT Film,1
Can Bob Iger revive Disney? | FT Film,1
Italian companies suffer Russia market loss | FT Film,1
Why 3D printing is vital to success of US manufacturing | FT Film,1
"North Korea and the triads: gangsters, ghost ships and spies | FT Film",1
Roger Federer and Trevor Noah on why you should visit Switzerland | FT Globetrotter,1
Why was Elon Musk’s acquisition of Twitter such a tortuous saga? | FT Due Diligence,1
Private capital firms are targeting super-rich families and individuals | FT Due Diligence,1
FTX: the legend of Sam Bankman-Fried | FT Film,1
The Carbon Market Opportunity | FT Rethink,1
The business of Formula 1: inside McLaren HQ | FT Scoreboard,1
Falling wind speeds could affect green energy strategy | FT Rethink,1
Football empires: The rise of multi-club ownership | FT Scoreboard,1
The story behind Jake Freeman’s meme-stock bonanza | FT Due Diligence,1
The ESG investment backlash is beginning to have an impact | FT Moral Money,1
"Capture, who&#39;s looking after the children? | FT Film Standpoint",1
How the buyout of Morrisons turned into a costly blunder | FT Due Diligence,1
How technology is helping protect the wine sector from climate change | FT Energy Source,1
Battling the avian flu epidemic | FT Food Revolution,1
A bespoke approach to digital learning and development | FT Tech,1
Fusion power: how close are we? | FT Film,1
India and the business of women&#39;s cricket | FT Scoreboard,1
Could battery storage help with the US energy crisis? | FT Energy Source,1
Fractured markets: the big threats to the financial system | FT Film,1
The technology behind self-management of chronic diseases | FT Tech,1
Planetary Boundaries: What are they and why shouldn&#39;t we cross them? | FT Rethink,1
US bank branch closures widen social inequality | FT Film,1
Former PLA officer says China is restraining Russia over use of nuclear weapons | FT,1
Has Big Oil changed? | FT Film,1
Inside London&#39;s &#39;zero waste&#39; restaurant | FT Food Revolution,1
"Manufacturing in America, post-globalisation| FT Film",1
Qatar&#39;s World Cup legacy | FT Scoreboard,1
Are deposit return schemes really the best way to cut litter and emissions? | FT Food Revolution,1
US offshore wind: tapping into an underused resource | FT Energy Source,1
"Sell-to-yourself is on the rise, but who gets the best deal? | FT Due Diligence",1
"American LNG exports are surging, on the back of European demand | FT Energy Source",1
Desirable yet divisive: electric vehicles in the US | FT Energy Source,1
The Brexit effect: how leaving the EU hit the UK | FT Film,1
Reinventing farming and food post-globalisation | FT Film,1
The strategic moves that transformed AC Milan’s fortunes | FT Scoreboard,1
Riverford: UK business needs long-term policies and stability | FT Food Revolution,1
Brazil: a nation divided | FT Film,1
The race is on for green tech resources | FT Energy Source,1
Will Tesla&#39;s Optimus robot become a reality?  | FT Tech,1
Is plant-based meat staying on the menu? | FT Food Revolution,1
"Is buy now, pay later a sustainable business model? | FT Tech",1
Queen Elizabeth II: a long life of duty and service | FT,1
How Putin held Europe hostage over energy | FT Energy Source,1
Gordon Ramsey VS Woman in COMPLETE denial,0
My Dog Cringes at TikToks..,0
"Kid wants $1500 Allowance, to Buy Gucci Shoes....",0
My 7 Billion $ Setup Tour,0
Why Japan?,0
This show is PEAK Entertainment!,0
I t̶r̶i̶e̶d̶ ̶t̶o̶ beat Elden Ring Without Dying..,0
Hitman VR is Hilariously Bad..,0
Gender Reveals Are Something Else..,0
My Workout (10% Muscle increase),0
This was not what I expected..,0
Elden Ring #1 - 0 DEATH PLAYTHROUGH,0
My 6 Billion $ Setup Tour,0
I Eat Forbidden Bananas..🍌🍖🍌🍖🍌,0
My Minecraft House Tour - Minecraft Hardcore #24,0
Spiderman fans please explain yourselves..  #97[REDDIT REVIEW] /r/blursedimages,0
Next Gen Graphics Is Kinda Nuts..,0
I Fell Into The New Minecraft Lush Cave! - Minecraft Hardcore #22,0
They figured out atoms existed thousands of years ago but we are still depressed lmao🙌 BOOK REVIEW 🙌,0
Youtube copyright seriously pisses me off.. 📰PEW NEWS 📰,0
Rating/Reacting To Reaction Channels,0
THIS... Is How You&#39;re Supposed To Eat A Pizza..,0
Reacting To The Worst Plastic Surgeries,0
Mr Beast Squid Game Review,0
New GTA Definitive Edition is hilariously bad,0
Ive considered steroids - Jubilee React #22,0
YouTube Removed The Dislike Button.. 📰PEW NEWS 📰,0
Travis Scott Apology Review 📰PEW NEWS 📰,0
7 Reasons Why Sinks Are Bad.,0
I Followed A Forbidden Recipe..,0
I Met PewDiePie in YouTubers Life 2,0
What a MILLION Dollars Gets You Around the World?,0
Trying to Explain Parallel Universes With My Last 2 Remaining IQ,0
Parents Tell Kids About Birds And Bees...,0
How Fish Is Made (HowItsMade #2),0
Kids Describe Colour To A Blind Person,0
Who Is Not A Middle Schooler? Jubilee React #20,0
NEVER Bring Your Minecraft Axolotl to the Nether....... - Minecraft Hardcore #20,0
Strangers Rank Their Intelligence Is KARMA - Jubilee React #18,0
Biomutant - New Game LIVE,0
I am Knife Flipp Master 2021,0
Cringe Compilations Needs to be STOPPED /r/Cringe  #87[REDDIT REVIEW],0
Seniors Needs to be STOPPED!,0
Woman Addicted to Eating Matressess - TLC #19,0
The Biggest Liar Cheapstake! - TLC #16,0
Stardew Valley - Part 1 - Cope Stream,0
Rescuing Villagers in Minecraft   - Minecraft Hardcore #9,0
Running Minecraft on MAX Graphics 16k - Minecraft Hardcore #8,0
Joining The Navy,0
I lost my best friend...  - Minecraft Hardcore #7,0
How Much Tape To Stop A Lamborghini?,0
"$1 vs $500,000 Experiences!",0
Can You Surf A Pool Table?,0
1 Subscriber = 1 Penny,0
Human vs Jet Engine,0
7 Days Exploring An Underground City,0
Will A Basketball Boat Hold My Weight?,0
"Find The Real MrBeast, Win $10,000",0
"100 Identical Twins Fight For $250,000",0
Running With Bigger And Bigger Lunchlys,0
"Men Vs Women Survive The Wilderness For $500,000",0
Will A Guitar Boat Hold My Weight?,0
"Real Or Cake For $10,000",0
7 Days Stranded In A Cave,0
Running With Bigger And Bigger Feastables,0
"Survive 100 Days In Nuclear Bunker, Win $500,000",0
"Spot The Fake Animal For $10,000",0
"50 YouTubers Fight For $1,000,000",0
How Many Balloons Does It Take To Fly?,0
I Built 100 Houses And Gave Them Away!,0
World’s Deadliest Obstacle Course!,0
"$10,000 Every Day You Survive In The Wilderness",0
Sprinting with More and More Money,0
Giving 1000 Phones Away,0
Bottle Head Smashing World Record Attempt!,0
"Protect The Yacht, Keep It!",0
Ages 1-100 Try My Chocolate,0
"Spot The Hidden People For $10,000",0
"Would You Split Or Steal $250,000?",0
"Buy Feastables, Win Unlimited Money",0
In 10 Minutes This Room Will Explode!,0
The World&#39;s Fastest Cleaners,0
"Ages 1 - 100 Decide Who Wins $250,000",0
"Guess The Gift, Keep It",0
"Anything You Touch, You Keep!",0
7 Days Stranded On An Island,0
"Keep Track Of Car, Win $10,000",0
"Protect The Lamborghini, Keep It!",0
I Survived 7 Days In An Abandoned City,0
I Filled Chandler’s Car With Feastables,0
"Buy Feastables, Win $10,000",0
"Face Your Biggest Fear To Win $800,000",0
"$1 vs $250,000,000 Private Island!",0
"Protect $500,000 Keep It!",0
I Spent 7 Days In Solitary Confinement,0
I Saved 100 Dogs From Dying,0
"Survive 100 Days Trapped, Win $500,000",0
"Feeding A Dog $1 vs $10,000 Steak",0
Could You Walk Up A Skyscraper?,0
"$10,000 Every Day You Survive In A Grocery Store",0
Markiplier&#39;s Halloween Scream Stream | rOUTE8 + MOUTHWASHING,0
PowerWash Pals: CrankGameplays,0
bad leadership... | Raft,0
BACK INTO THE DEEP! | We Need To Go Deeper,0
stealing other people&#39;s content,0
Mavis Beacon Prepares Markiplier for War,0
Absurd Trolley Problems,0
Mavis Beacon Teaches Markiplier Typing,0
The Day I Broke My Ass,0
Iron Lung: THE LORE UPDATE,0
i&#39;m back... | Raft,0
Smash or Pass: MatPat&#39;s NEW Perfect Pokémon,0
YOUR PHONE IS STILL WATCHING YOU | Simulacra 2 - Part 1,0
BACK TO SATISFYING | PowerWash Simulator - Part 11,0
Bob&#39;s Fridge,0
2 Boys 1 Ball,0
"GHOST HUNTING with FRIENDS! | Devour w/ Bob, Wade &amp; JackSepticEye",0
Mr. White is standing right behind you...,0
Mr. Hopp&#39;s Manor Escape,0
The Stanley Parable: Ultra Deluxe | FULL GAME,0
Mark Is Too Stupid to Understand Sports,0
In Space with Markiplier: Part 1,0
Five Nights at Freddy&#39;s Sister Location: REVISITED,0
Five Nights at Freddy&#39;s 4: REVISITED,0
Five Nights at Freddy&#39;s 3: REVISITED,0
Five Nights at Freddy&#39;s 2: REVISITED,0
Mark and Bob Bunk Their Beds,0
3 SCARY GAMES #84,0
Smash or Pass: All 898 Pokémon,0
The Blood Bowl,0
3 SCARY GAMES #83,0
Heavenly Bodies w/ Sean - Part 3,0
Analogue Horror,0
ALL BOSSES ON HARD MODE!! | Rogue Legacy 2,0
Inscryption - Part 6,0
Five Nights at Freddy&#39;s: Security Breach - Part 9,0
Five Nights at Freddy&#39;s: Security Breach - Part 1,0
Rogue Legacy 2,0
EVERYTHING WILL KILL YOU | Shut In,0
HuniePop 2: MEGA EPISODE,0
Back 4 Blood,0
BILLIONS OF ZOMBIES,0
Gas Station Simulator,0
A LOT OF ZOMBIES,0
BEECOME THE BEE | Bee Simulator,0
THE END OF SPOOKY | Spooky&#39;s Jump Scare Mansion: The Doll House - Part 3,0
Spooky&#39;s Jump Scare Mansion: The Doll House - Part 2,0
Spooky&#39;s Jump Scare Mansion: The Doll House - Part 1,0
THE SPOOKIEST DOOT | Trumpets,0
Voidtrain - Part 2,0
"Why I Left MrBeast’s $1,000,000 Challenge",0
I Challenged The World’s #1 Tetris Player (He’s 14),0
I’m Going To Be A Dad,0
LOGAN PAUL - WHY 2023 WAS THE BEST YEAR OF MY LIFE,0
I am a WWE Champion,0
I Almost Lost The Fight,0
My Boxing Return,0
I Got Engaged,0
I Ended KSI’s Career,0
KSI Left Prime,0
Logan Paul &amp; KSI - Prime’s Big Game Commercial,0
LOGAN PAUL - WHY 2022 WAS THE BEST YEAR OF MY LIFE,0
Logan Paul &amp; KSI Surprise Fans With Prime Energy,0
I’ll Never Fight Again,0
"I Took 4,120 Polaroids In 99 Days",0
"I Bought The World’s Most Expensive Pokémon Card ($5,300,000)",0
Logan Paul &amp; KSI Went Bald For Prime,0
I Made A Masterpiece | Logan Paul&#39;s 99 Originals (Official Trailer),0
Logan Paul &amp; Arnold Schwarzenegger | Slap Fighting Championship (Official Live Stream),0
Logan Paul &amp; KSI Go Undercover At Walmart,0
"I Lost $3,500,000 On Fake Pokémon Cards",0
I Started A Drink Company With KSI,0
My Last Words To Floyd Mayweather...,0
I’m Fighting Floyd Mayweather This Week,0
I Boxed 4 People At The Same Time,0
Face To Face With Floyd Mayweather,0
"Opening The $1,000,000 1st Edition Pokemon Box (Official Live Stream)",0
"I Spent $2,000,000 On Pokémon Cards",0
Logan Paul - 2020 (Official Music Video),0
I FaceTimed Floyd Mayweather...,0
"I Spent $150,000 On This Pokémon Card",0
"Opening The $200,000 1st Edition Pokemon Box (Official Live Stream)",0
"I Bought A $200,000 Box Of Pokémon Cards",0
Goodbye Forever.,0
TEKASHI 6IX9INE 🌈,0
She Couldn&#39;t Hold It In Anymore...,0
I Cheated,0
Trapped With My Girlfriend At -202 Degrees,0
I Painted Josie Like One Of My French Girls,0
Will My Boys Lie To My Girlfriend For Me?,0
Hollywood Changed Us...,0
We Ran Away Together,0
"Can I Borrow $250,000?",0
This Got Me In Trouble...,0
He Always Has My Back,0
We Discovered A Hidden Mountain Lake,0
This Was A Mistake,0
Jake Paul Warned You.,0
WE DID IT ON A PLANE!,0
The Hardest Thing I’ve Ever Done,0
DanTDM Will Never Be Able To Do This,0
IShowSpeed Made Me Laugh,0
"If You Think This Is KSI, You&#39;re Racist",0
The Comments On These Videos Are Too Funny!,0
This Wasn&#39;t Funny...,0
THE HATE ON MY MUSIC IS FORCED,0
I&#39;m getting cooked...,0
Why Would You Even Confess This?,0
THIS KSI COVER IS HILARIOUS,0
"The 6 Pack $1,000,000 Bet",0
KSI RETURNS TO BOXING | LAUNCH PRESS CONFERENCE LIVESTREAM,0
KSI VS JAKE ISN&#39;T HAPPENING...,0
I Don&#39;t Know If We Can Laugh At This...,0
ONE OF THE FUNNIEST VIDEOS EVER!,0
THESE COMMENTS ARE OUTRAGEOUS!,0
CAN&#39;T STOP LAUGHING AT THESE!,0
ANSWERING YOUR ASSUMPTIONS (UPDATE),0
I HAVE RETURNED!,0
KSI Regretted this IMMEDIATELY😭 #ksireacts #ksi #sidemen #stream,0
MY FIRST TRY NOT TO LAUGH... LIVE!,0
MY REDDIT HATES ME,0
KSI VS. TOMMY FURY &amp; LOGAN PAUL VS. DILLON DANIS MAIN EVENT PRESS CONERENCE LIVESTREAM,0
Why Am I Getting So Much Hate?,0
KSI VS. TOMMY FURY | MISFITS X DAZN X SERIES 10 OPEN WORKOUTS,0
KSI Boxing Documentary,0
Misfits x DAZN X Series 009: Idris Virgo vs. Aaron Chalmers DAZN Boxing Countdown Show Livestream,0
Misfits x DAZN X Series 009: Idris Virgo vs. Aaron Chalmers Press Conference Livestream,0
A Normal Try Not To Laugh Video,0
Can This Bread Make Me Laugh... Again?,0
It’s Getting Too Much!,0
Try Not To Laugh: Water Edition,0
I Got Trolled,0
10 YEAR ANNIVERSARY OF THE KSI REDDIT,0
My Thoughts On My Last Fight,0
KSI VS. JOE FOURNIER DAZN BOXING COUNTDOWN SHOW LIVESTREAM | MISFITS x DAZN X 007,0
Am I Right?,0
KSI VS. JOE FOURNIER PRESS CONFERENCE LIVESTREAM | MISFITS x DAZN X 007,0
KSI VS. JOE FOURNIER | MISFITS x DAZN X 007 OPEN WORKOUTS LIVESTREAM,0
Misfits x DAZN X Series 006: JMX vs. Le&#39;Veon Bell Weigh In Livestream,0
Is This Happening?,0
ChatGPT Doesn&#39;t Rate Me,0
BRUTALLY HONEST REVIEW OF PRIME,0
MF &amp; DAZN X 005: Jay Swingler vs. NichLmao Weigh-In Livestream,0
3 YouTubers Vs 3 Arsenal Footballers,0
How Was This Allowed?!?,0
I hated doing this…,0
I Can&#39;t Believe He Did This,0
This Is Why I&#39;ll Beat Jake Paul,0
MF &amp; DAZN X 004: KSI vs. FaZe Temper DAZN Boxing Countdown Show,0
IT&#39;S TIME!,0
We Won Every Game at the State Fair!,0
Mystery Detective Battle: HALLOWEEN,0
Dude Perfect Headquarters is GONE!,0
Our Longest Trick Shots EVER,0
Football is BACK! 🏈 Let&#39;s kick it off with some tailgating trick shots with @Reeses !,0
Which one was the worst? 🤣,0
CeeDee is SMOOTH with it,0
Dude Perfect vs Mark Rober: Battle Bots,0
Awkward Stereotypes,0
End of an era 🥺. DPHQ3 reveal COMING SOON!,0
F1 Edition | Dude Perfect,0
Olympic Mini Games Battle,0
This should be an Olympic sport,0
We Dropped 1000 Basketballs from an Airplane,0
Island Survival Games,0
Dad Stereotypes,0
Dads be like...,0
Dodgeball Island Battle Royale,0
Gonna tell my kids this was Spider-Man,0
Australia Bucket List,0
Dude Wars 2 | OT 45,0
How it started vs how it’s going,0
"LEGOOOOO! One year ago, the impossible happened.",0
We Remade Our 1st Video 15 Years Later,0
Make it or break it! (That last level 🤯),0
Dude Perfect vs. MLB Pitcher,0
"THE WINK AT THE END 💀 Storybook day at the @Formula1 AGP for Ty and the CHAMP, Carlos Sainz!",0
The Tesla Coil Electricity Gun! | OT 43,0
Prison Escape Battle,0
HOW did that happen to Ty at the end?!,0
Honestly whoever did it should just own up,0
Office Stereotypes | Dude Perfect,0
Medieval Battle,0
Which level took the longest?? 🏈,0
We Put a Rocket in a Football,0
INSANE ROCKET FOOTBALL THROW 🤯🚀,0
this stuff is CRAZY 🤯,0
Pet Stereotypes,0
What was that?!? 🤣🤣 #challenge,0
How did Zach do that?? 🤯🪄,0
WHO had the best response? 😂🦉,0
Mystery Detective Battle,0
Watch closely… 🫨🪄,0
We took the record back 🤠,0
Top 10 GIFS of ALL TIME | OT 42,0
Kinda satisfying tbh 😯,0
Luckiest Dude Wins,0
Which dude drank the lime juice?? 🫨,0
Punishment Plinko is NASTY 🤢,0
NECK &amp; NECK 🤯,0
James Charles - Used To Love Me,0
YOU’LL NEVER GUESS WHO I TRANSFORMED INTO… 😱🔎 #halloween #makeup,0
PLAYING DRESS TO IMPRESS INSANE HALLOWEEN UPDATE! 🤯,0
AVATAR HALLOWEEN TRANSFORMATION 🤯🩵 #avatar #makeup #halloween,0
RECREATING MY FOLLOWERS HALLOWEEN MAKEUP LOOKS!! 🎃🪲🐆,0
CAN’T BELIEVE THIS HAPPENED 🤯,0
FULL FACE OF MAKEUP FROM THE UK! 🇬🇧,0
BENTLEY BENTAYGA HONEST REVIEW,0
FULL FACE OF NEW MAKEUP LAUNCHES! *honest reviews 😬*,0
I AM NEVER PLAYING DRESS TO IMPRESS AGAIN,0
PERFECT BLUSH IN 3 EASY STEPS!,0
FULL FACE UNDER $50 AT TARGET MAKEUP CHALLENGE!,0
"$200,000 MERCEDES MAYBACH HONEST REVIEW 😬",0
BRUTALLY HONEST DAY IN THE LIFE,0
YOU HAVE BLUSH BLINDNESS! 🛑,0
PAINTED BLUSHES REVEAL... FINALLY! 💞,0
WINNING DRESS TO IMPRESS,0
SHEIN STOLE MY BRAND’S PALETTE! 😡,0
SHEIN STOLE MY BRAND&#39;S PALETTE! 😡,0
ROBLOX DRESS TO IMPRESS IS CRAZY,0
CYBERTRUCK HONEST REVIEW 🤐,0
Playing ROBLOX Dress To Impress!,0
JUDGING MY FOLLOWER&#39;S MAKEUP LOOKS,0
Trying A FULL FACE Of Makeup from COVERGIRL.. 🫠,0
"I&#39;ve spent $100,000 on AMAZON... 😅 These Are My FAVORITE Purchases",0
Full Face Of GLITTER Makeup ✨😭,0
Trying A Full Face Of Makeup From BRAZIL! 🇧🇷,0
Exposing 100 WORST 5 Minute Craft Makeup Hacks,0
Full Face UNDER $100 From SEPHORA Makeup Challenge!,0
James Charles - Bring Me Water,0
H&amp;M Released Their Own Makeup Line... And It&#39;s Trash 🗑️,0
Full Face Of Makeup From ITALY! 🇮🇹,0
Trying A Full Face Of Makeup From MARSHALLS!,0
Wearing ONLY TikTok Shop For A Week! (FAIL),0
Full Face UNDER $100 From Ulta Makeup Challenge!,0
Unedited Makeup Tutorial (Kinda),0
I Buried My Makeup Routine In A Time Capsule,0
How I Made My First Ever Music Video,0
James Charles - Can We Just Be Friends (Official Music Video),0
HIS REACTION MADE ME CRY 🥹,0
Come With Me To Coachella 2024!,0
THEY PLAYED MY SONG AT COACHELLA OMG,0
5 Minute Craft Makeup Hacks... Blink Twice If You Need Help,0
I CLIMBED ONTO MY ROOF FOR THIS,0
MY NEW SONG IS CALLED...,0
Wearing The World&#39;s Longest Wig For A Day!,0
I Bought A $2000 Makeup Mystery Box From An INFLUENCER!,0
WORLDS BIGGEST BEAUTY BLENDER 🤯😂,0
Reacting To People Reacting To My First Song 😬,0
High Makeup Tutorial 🍃,0
HOT TUB WITH INTERNATIONAL MODEL!!,0
SURPRISE MADE HER START CRYING!!,0
SURPRISING FRIENDS WITH WORLDS MOST EXPENSIVE HOME!!,0
STRANDED WITH HER IN SOUTH AFRICA!!,0
SURPRISING NAILEA WITH FAVORITE CELEBRITY!!,0
RICH GIRL INVITES ME ON HER JET!!,0
CAUGHT FLIRTING WITH MY BEST FRIENDS GIRLFRIEND!!,0
HOT-TUBBING WITH DREAM GIRL!!,0
TELLING HER MY BIGGEST SECRET!!,0
WHAT IS HAPPENING TO MY EYE!!,0
I COULDN&#39;T STOP CRYING!!,0
THIS DID NOT END WELL!! (ACCIDENT),0
CONFRONTING HATER IN REAL LIFE!!,0
MY FIRST TIME LEAVING THE COUNTRY!!,0
SURPRISING A VERY SPECIAL WOMAN!!,0
SHE CRASHED HER DREAM CAR!!,0
SURPRISING MY LITTLE BROTHER WITH MR.BEAST!!,0
CONFRONTING HER BOYFRIENDS EX-GIRLFRIEND!!,0
"SHE MADE $4,000,000 IN ONE MONTH!! (FREAKOUT)",0
BUYING AN AIRPLANE EMERGENCY SLIDE!!,0
SURPRISING BEST FRIEND WITH DREAM GIRL!!,0
SURPRISING LITTLE BROTHER WITH TUPAC!!,0
FAMOUS RAPPER MAKES LITTLE KID CRY!! (FREAKOUT),0
SURPRISING FRIEND WITH LIFE CHANGING SURGERY!! (EMOTIONAL),0
SURPRISING BEST FRIEND WITH PUPPY!! (FREAKOUT),0
SURPRISING MY FRIENDS!!,0
03/22/21,0
WE CANT BELIEVE THIS HAPPENED!!,0
WE DROVE A CONVERTIBLE INTO A CAR WASH!!,0
THIS WAS A HORRIBLE IDEA!! (FIRE),0
SHE TRIED MAKING OUT WITH ME!! (CAUGHT),0
CONFESSING HIS LOVE FOR MY ASSISTANT!!,0
SURPRISING MY ASSISTANT WITH PUPPY!!,0
PUTTING HIS DRUNK TEXTS ON A BILLBOARD!!,0
MY TESLA FLEW OFF THE GROUND!!,0
MAKING MY CHILDHOOD DREAMS COME TRUE!!,0
SURPRISING PEOPLE WITH JUSTIN BIEBER!!,0
WE BURIED MY FRIEND IN THE BACKYARD!!,0
WORLD RECORD FOAM EXPERIMENT!! (INSANE),0
REAL LIFE IRON MAN SUIT!! (JET PACK),0
THIS IS HOW HE BROKE HIS ARM!! (CAUGHT ON TAPE),0
SURPRISING MY ASSISTANT FOR HER BIRTHDAY!!,0
MOM CAUGHT HIM IN DAUGHTERS BED!!,0
COCA COLA VS MENTOS INSIDE HER MOUTH!!,0
SURPRISE DREAM VACATION!! (FREAKOUT),0
THIS WAS MY FIRST TIME MEETING HER!!,0
MY FIRST CAR ACCIDENT CAUGHT ON CAMERA!!,0
HOW TO HACK ANY VENDING MACHINE!!,0
BACKWARDS JET PACK BASKETBALL TRICK SHOT!!,0
COCA COLA VS MENTOS INSIDE CAR!!,0
SIDEMEN FORFEIT FOOT GOLF,0
SIDEMEN YOUTUBER PUB QUIZ,0
SIDEMEN FOOD TRUCK ROAD TRIP,0
"SIDEMEN SPEND $100,000 ON EACH OTHER: FORFEIT EDITION",0
SIDEMEN AMONG US IN REAL LIFE JESTER EDITION,0
SIDEMEN ULTIMATE CALORIE BATTLE,0
SIDEMEN HIDE &amp; SEEK IN UK’S BIGGEST SHOPPING CENTRE,0
We Bought 10 Abandoned Storage Units and Made £______,0
GUESS THE CRIMINAL,0
CAN YOU SPOT THE DIFFERENCE?,0
SIDEMEN LAST TO LEAVE THE FOOTBALL PITCH,0
SIDEMEN COME DINE WITH ME (2024 EDITION),0
SIDEMEN ONE MILLION POUND DROP (IRL CHALLENGE EDITION),0
We Raced Across The World&#39;s Richest Country in 24 Hours,0
"SIDEMEN $1 vs $10,000 MYSTERY BOX",0
"SIDEMEN £1,000 BOAT CHALLENGE",0
How Many Countries Can You Visit in 24 Hours?,0
SIDEMEN MOST EXPENSIVE CAR CHALLENGE,0
SIDEMEN ULTIMATE HIDE &amp; SEEK ON AN ISLAND vs 40 YOUTUBERS,0
SIDEMEN AMONG US IN REAL LIFE: KSI MASTERCLASS,0
We Opened The Most Chaotic Restaurant Ever,0
SIDEMEN SURVIVE THE FOREST FOR 24 HOURS,0
"SIDEMEN $1,000,000 REALITY SHOW: INSIDE FINAL",0
"SIDEMEN $1,000,000 REALITY SHOW: INSIDE EP. 1",0
SIDEMEN SURVIVE 24 HOURS IN UK’S MOST HAUNTED HOUSE,0
SIDEMEN HUNTED ACROSS THE UK,0
YOUTUBERS CONTROL WHAT SIDEMEN EAT FOR A DAY,0
"SIDEMEN $500,000 vs $500 MOBILE HOME ROAD TRIP",0
SIDEMEN AMONG US IRL: EMERGENCY MEETING EDITION,0
SIDEMEN HIDE &amp; SEEK AT W2S HOUSE,0
WOULD I LIE TO YOU: SIDEMEN EDITION,0
"Last To Pee Wins $100,000",0
SIDEMEN BECOME MODELS FOR 24 HOURS,0
SIDEMEN STAY AT WORLD&#39;S WEIRDEST AIRBNBS,0
"SIDEMEN $20,000 vs $200 WINTER HOLIDAY",0
